,Title,Company,Location,Description,URLs
1,iOS Developer,Interglobe Technologies Private Limited,None,"Description: Design and develop software applications (apps) for mobile phones, Smartphones, tablets, and other mobile devices. May develop on one or more...",http://www.indeed.com/pagead/clk?mo=r&ad=-6NYlbfkN0CTbpH6WG2oZ0VskstjGh-c-A9y17CGsG1TpevbY9CZaHNa0cJTopZMMistW_VKieREbnz6GroW6er_YxokExHk0NI9r9SUZd-nOV6czP9ZDY1riq8Y87z2I8zJqYlj-3x01y5A6iDF0ov6N1t7Bnke1xKLL-dGR-0aQVUP7N_MKdG_QUnsl86WzsyGqSwuCZLNix2hY3blh_ev9xN6v2fVE8kB_gybe_Gacs2XFhvkCTDYa2gZ9gn-JzlmZ1Kuq4Z51Fq1yECpxxivK_c-0F-L0c0GWzOjtU0QzjfJQm9i2mhHvOIu5LyAxb07FIv5VC7kK5cUdexL8QXoZQPTXzlR3hFb7AQCgUx5f7NItcfkFzUMLrHbEgMFJa6APNhdf89Zq7Q8I63qdmrPalNb1_Hr0WF8rofpInMibjddueb_0A==&vjs=3&p=2&sk=&fvj=1
2,Full Stack Developer,Occidental Petroleum,None,"Looking for an experienced full stack developer. 2+ years of proven experience as software developer using C#, Angular, JavaScript, CSS....",http://www.indeed.com/pagead/clk?mo=r&ad=-6NYlbfkN0CDibRvPqijAsqagEY3iyZWa6_eypXWDnbORbRJ1rhV_FU-By_wImI1d5xB3dQwD0QcT9LUZFhIs-eNjWu6GEKP0pmUvEsvN8xEt8mTDeQisqaWVlAoDaA1hLpRBSGlSf8zJci-6AiASaaf7oBNKsu5m3J_FCrjOHQc6wLVs1Rf3eU3zGjNhXOkplmJfjdziYglsJ-0p4LtTu87WLcRr36o8OkCurRIgAr_xmn_Lf6gQcGJePeFMd8vxuCNxYLJ3r7-P7l8jiWle-5rUrOw4dB5xD3IshrG2q7koTUrB9MS5Oh5qZI0B4xO34IPzKM_0QMMPLmrXIftM1lepEIJw3kj4xfCxq47T86tMeBsWkKGXeKuC_swQCgoIDB7M9yKS2hnEdY_KrUtmuSbPpfUd7sHUjryotKy4BGC66tsuEVwj08whhuidpZtRMUg7hX0NZUbw2bdIYPW7Q8z4vzcr4_4TS5pXbn_dJt6NYI5_9IQoA==&vjs=3&p=3&sk=&fvj=0
3,Engineer - Embedded Software Programmer,Emerson,None,"At Emerson, we are innovators and problem-solvers, focused on a common purpose: leaving our world in a better place than we found it. Each and every day, our...",http://www.indeed.com/pagead/clk?mo=r&ad=-6NYlbfkN0C0yHrujcxMCbkaG3IbA09ELIIJjJgF-_zVRJpDqTq0TZ2sS-itgKb--ZiSouCBCD1BmsXmtLh6xCzdiyMnDeL6zfOr7hgAOGzWO3yL9UKIRGEGOAOHkN8GLObhdbFJf7IqwwLRCvW1UISHtiR8s40U3ceuHoarKCl4tWjHJygw6hvPqWPCt7NEZxpizKtVTPKpUIRlWkmydBYqK71zsmrfRD3N4Wkylij6OmLtX5h5kZc8qrDCo8C672-G5EWH6StSJvv3YQggeeVe8UU0XKiQZr4h2gHu17VbSI6Bsspv17UeSkk_Q2eSegy_bPkSCOQ-lD9E9_x1q_OHJyAe4jJ0x_TnvqTaWinAujC8Zf_iDAzh7e46hTj_N8-NKmyey3jmvnImh8AYj6cFHL4NIv4Elu66qUnZViP3wO279t4ltnWcCWSXOie0iMNeTfdx-_c=&vjs=3&p=4&sk=&fvj=0
4,Back End Developer,Tietronix,"Houston, TX","3 – 5 years of experience in back end development in Java. Tietronix Software seeks a Back-End Web Developer to support Tietronix Life Sciences in Houston,...",http://www.indeed.com/rc/clk?jk=6ee37b19359c5659&fccid=04fae56a44fee2d9&vjs=3
5,Front-End Developer (React),Expero,"Houston, TX","At Expero, we build complex, reactive web applications for expert users: scientists, traders, engineers. If you enjoy lighting up a screen with an intricate...",http://www.indeed.com/rc/clk?jk=0a379f6dd0c07358&fccid=b3849afe7b6c9bf1&vjs=3
6,Backend Developer,"StormFire Technologies, Inc.","Houston, TX",We are looking for a Back-End Web Developer responsible for managing the interchange of data between the server and the users....,http://www.indeed.com/rc/clk?jk=5f70ec11778202a2&fccid=0e6f14010e8cced0&vjs=3
7,Full Stack Developer (PHP/MYSQL/HTML/CSS/Javascript),Comedy Driving Inc.,"Houston, TX 77079 (West Houston area)","1-3 Years of Back End Development (PHP/Mysql). Full Stack Developer (PHP/MYSQL/HTML/CSS/Javascript)*. 1-3 Years Front End Development (HTML, CSS, Javascript)....",http://www.indeed.com/company/Iron-Property-Insurance-Agency/jobs/Full-Stack-Developer-581a33e434ec575e?fccid=7d80c0ca5e8b30d6&vjs=3
8,Junior Java Developer,Modiant LLC,"Houston, TX 77002 (Downtown area)","SUMMARY Modiant, a world-class, data-driven product development company headquartered in Union Station at Minute Maid Park, is one of Houston's most exciting...",http://www.indeed.com/rc/clk?jk=a9f218eebb617047&fccid=f38b4ee15af192ae&vjs=3
9,Android Developer,REm2,"Houston, TX",We are looking for an Android developer responsible for the development and maintenance of applications aimed at a vast number of diverse Android devices....,http://www.indeed.com/company/REm2/jobs/Android-Developer-f05c75078d688b61?fccid=39c09a8ff71d351f&vjs=3
10,Service Desk Technician II,Crestwood Ops - IT,"Houston, TX",Liaise with network administrators and software developers to ensure a positive end user experience. The Service Desk Technician II will be responsible for...,http://www.indeed.com/rc/clk?jk=410055bf20326093&fccid=9af1d9b38d6db4df&vjs=3
11,Sr. Front End Developer,Modiant LLC,"Houston, TX 77007 (Rice Military area)",5+ Years of Front End Development Experience. Peer review developer code and provide constructive feedback. Demonstrated leadership of Front End development in...,http://www.indeed.com/rc/clk?jk=8e11448fcc309be8&fccid=f38b4ee15af192ae&vjs=3
12,Sr. Software Developer - Front End,RigNet,"Houston, TX 77084","Software Developer, Front End – Houston, TX. Good customer focus with end user experience. Experience with front end technologies, web libraries and frameworks....",http://www.indeed.com/rc/clk?jk=cc8758820c31c56e&fccid=2a627778b69ab968&vjs=3
13,Python,Ace Technologies,"Houston, TX","This Developer should have Python 2.7(experience with 3.6 is preferred) and advanced understanding of Flask. I need a Back-End Python Developer, with excellent...",http://www.indeed.com/rc/clk?jk=9334b40fa20370af&fccid=b7287cc45de81a80&vjs=3
14,Java Developer,"Pride, Inc/",None,"*Java Software Developer About the Company: * Pride Automation, Inc. (PAI) is a wholly-owned subsidiary of TRACLabs, Inc. that was incorporated in 2013...",http://www.indeed.com/pagead/clk?mo=r&ad=-6NYlbfkN0Ak89Zvl_2SM4M0Ujk9_p-BEsj4icFnutsf_M03cAogaBV3Fov_MiiuJbZhlqDEa_A9OrWOyVugn-T6H09ZkQELgTcSgXPs-HA0vIiB-0m_zujZRt80qrfnqB944USr5naFfL3Xqiw796WQ_FoB4dR1NnYUdEpQS16U5j4EJRpuPWq8toDPggzPz-0_bS1EWHfWvvX9HE_i-u5oQltfDHREdugrQVIqfor1BXkv6_CKXdHel27kZj5rlKW3Bksymdi4XX_vuZOM8Ph4c495vHdUKm9wcGucsAf7zKgN-izj-e1lTms956nzKpRwH5KN3fviT127ynHo-12m4hW1YZ-_55A63BnrNWNIOW18yAxaeG3zPVsRNT4lsjM0iIjxA22ItiTrzkUeRYks_NM2i2_bOZBsb5Cyhar3bJX81YlEQmmqQtrxHr-p&vjs=3&p=5&sk=&fvj=1
15,Full Stack Developer (PHP/MYSQL/HTML/CSS/Javascript),Comedy Driving Inc.,None,"1-3 Years of Back End Development (PHP/Mysql). Full Stack Developer (PHP/MYSQL/HTML/CSS/Javascript)*. 1-3 Years Front End Development (HTML, CSS, Javascript)....",http://www.indeed.com/pagead/clk?mo=r&ad=-6NYlbfkN0D6ql45TvhmyxyUEiIIxV0OnjDnu3nOES3qBqkrUt74z4xXH0m3a8EbOesEBSph3d_muXBLduec79ydIOt1G-Obc_nbk1tl1bEqai8v0TXo_G6qIDZBTt-4qEpaeiQBC3GYOnh8ZTotGUZNPfMb_8ERF_P0WY9fVb62cGE-s4mqvpuArBbDgkvMfjakBEYadaXhmSrVLFe9JjqSDZzSOnPoOfWUFLecdtdjwQxcuSOCG9WwwH9GuAr9MTdRCXmdntyd_ykww-iTBaNZq64y64bngRjT8DvgzbhyVbN-V3UF0NeMWv6oZWtj8AhbGzfxe-jI93VbPP2rmyECZ8VlbhW5DQh2hJNhXNR0YO3qNH_7j-jpx1QlY_xfHwPBLMuNxMpJ9wEmP3T8tAB8NMl5Wl78WKPS2Xr0fVkUW8K_hrFfwGsdPG88E2AmkyfQMp67ANaRvSJtE8GtGcLJ5p8-SF9zG-GO9JPtrQp50uQM_QMLTQ==&vjs=3&p=6&sk=&fvj=1
0,Innovation Technologist,Leidos,None,"Has a career opportunity for a Software Developer to join our Innovation Center, a research, development and rapid prototyping center....",http://www.indeed.com/pagead/clk?mo=r&ad=-6NYlbfkN0CZUO70VSdYKA8PR3jfrSh5ljhqJhfDt0PzQCMubt8cRqAlH-JnDNgekFC7J2VEVO1pQtrXQHRfpvQfE2_3UaT7QuGyeQjCvuX0me6W-3GlfuO691t52gbzjiLDqU4E25lV67R4GjqdBjT2QTbTMSf_vUpAHXdBx17bE0pIvPie9Jef9toSOAOsntdOUir9Z47vDwN0M0ZcY25G902wFMUurVO0An9yoILItagtKuuxOr2jvTK45lRqjr8ol9_7RCb7QVaNWwn62P67kZB9TKB1kxjMbKskJztUvLFy525DWV3_LXR6uRjc-sC17A0nkbaqmTpnjMjAL0epEUyXEMgNr2LN8ZQ5TdlCfgT3WbPV_v8_bPskLdLptVf7pa0x3-bMxJKl_MKMWtVsO4mltp7DTTnwC9dAzdZRvhrOegX6V5JruOLj2OTBV7yOg-_gHKz2IiZtXyrkm6IY3NPZqHPnL2ARrYYp33Mb-j2pUOiVqi_GK52qbFfIrVE2RswsZyAn4f4YaRk9Q7Zu90jJd3iaJLh3_KcaaPU=&vjs=3&p=1&sk=&fvj=0
1,Java Software Engineer (Front-End),Study.com,None,"As we continue to generate profits, we give back to the community through our Working Scholars scholarship program that helps hundreds of low-income workers in...",http://www.indeed.com/pagead/clk?mo=r&ad=-6NYlbfkN0DTBdVKmZIyVUz9epjLLrinfsLp4iyHLMBJakMPxL5umH6MFH8lTIRrx2F3mrn2jrHPjgKMjloEzb8l78OWgqgeNqRZeJa4b_VHRUcn_i37C6tErbTMC-AaAyU0Z8mkEfvG5nW5z3afmq1ypPPi_n10V3XxNKcIDBH3hRwVEFhkJuUro8xWpzqeug3RiwEWkbOEXm4QzAYEEcZNTXGo2pkLQL02pnJtGSWJZFVdZZSTF2CsIk-dpsU_JQekNZXiKgwbIMvERbJ2diotsyCs70uYJoibbK37fL6m1sCSwVbdM46jOMN0gRBc6EsD0dvcTTZojnn1Zfe3XZhszHep0MJKH8VJiYdCY6tQ7vgio3VAa0LFEmXr8gnq_jYTkWCCxIHGgaDs1eg30dESdjrfiazdctojYTWuoyj0hrDn3zwxUdP8tJZtjSQDx1X8-CY8q2-1sdhd1Mmc0450hHl2XS_p-ioGF7gHKc1xtXibfc0l4_2jThF7cPBrZ2kD8I1uX18KcdY1Yn10rEXqA5IZ6MwoLbsq7e4DX_dWlJfEdpwU4A==&vjs=3&p=2&sk=&fvj=0
2,Sr. Applications Developer (Web),Staff Matters,None,Design and develop front end and back end architecture for web applications. Application Developer (Web). Sr....,http://www.indeed.com/pagead/clk?mo=r&ad=-6NYlbfkN0AtO1-dsP1CF3j1QeRchzcNKkk5D5K2DtLnBY7EFwSPvDsz-y8ZLKL9Xt2ynZX_FjZPM_RgmEW-bQdwzuG1RNSr1GsoNY8ffnP1r3YknzmWM2VGrot_hP1yte3OSr86CLpCGwIdDoydOkfPRk03DvVIDNFHprkjDL3PY13-s-O5jvCHhKATu5iFd0HlaspZDQC1uMzJ2dZw96nDVJC6kshegEOv2xzHu2f83utgtoPDxdUSUdOeEwOruDYfjF5jxquAGlVTMA8QdwHIoGBjB61MqxOepTzUWkRV5lkBKgBc-MfIpeI4UcuEHRDKnrSSk83h-AWGe_fCGqtBkaxdPSqYU7Povy7TFPOF66K-7W-Nh6ZjX8ilCHl8iT9xtAzYR6OlSQsgU8iWGzHmhvlETg2mj6tBtarY5e8VFmJTxE5cxd3swl9Tu_rMnK3tnAbq1XoxJKdQCu4HysjV241fCTVdg8HS10LDSl1mO0lyUDpzhI0TpqMjl092&vjs=3&p=3&sk=&fvj=0
3,Front-End Web Developer,Simpleview,"Tucson, AZ 85741","We are looking to add to our professional, dedicated and hard working team an independent, talented, top-notch Front- End Web Developer with a great work ethic...",http://www.indeed.com/rc/clk?jk=e7bfc848f3382d9a&fccid=dd31feee05020c5f&vjs=3
4,React Front-End Developer,Simpleview,"Tucson, AZ 85741","Job security (0 rounds of layoffs since day 1 way back when). We are looking to add to our professional, dedicated and hard working team an independent,...",http://www.indeed.com/rc/clk?jk=d7193d2f6d5fe436&fccid=dd31feee05020c5f&vjs=3
5,Front End/ Full Stack Developer,Simpleview,"Tucson, AZ 85741","We are looking to add to our professional, dedicated and hard working team an independent, talented, top-notch Front End/ Full Stack Developer with a great work...",http://www.indeed.com/rc/clk?jk=944386c5e694360b&fccid=dd31feee05020c5f&vjs=3
6,JavaScript Developer,Simpleview,"Tucson, AZ 85741","Job security (0 rounds of layoffs since day 1 way back when). We are looking to add to our professional, dedicated and hard working team an independent,...",http://www.indeed.com/rc/clk?jk=aaaba208a2d2e0e0&fccid=dd31feee05020c5f&vjs=3
7,Senior Web Application Developer,Leica Geosystems AG - Part of Hexagon,"Tucson, AZ",Design and develop front end and back end architecture for web applications. Duties & Responsibilities:....,http://www.indeed.com/rc/clk?jk=4ecb3402db1783cf&fccid=0a22ab36cf7af12f&vjs=3
8,Senior Software Engineer - (UI/Web Developer),Rain Bird Corporation,"Tucson, AZ 85756","As a Senior Software Engineer - UI/Web Developer, you will be responsible for the design and implementation of a Web based user interface that is used by...",http://www.indeed.com/rc/clk?jk=8612b6756679c386&fccid=a9ad6f532009f6a2&vjs=3
9,Browser Extension Developer (f/m/x) (relocated to Germany),Avira Operations GmbH & Co. KG,None,"Browser Extension Developer (f/m/x). As a developer your work will include implementing logic, backend integration and user interfaces for browser extensions....",http://www.indeed.com/pagead/clk?mo=r&ad=-6NYlbfkN0DVAdzec4bw6rQ4FO3PDdwz3gCZ43d7Gsr17jnu3o1g5CzDYok_FbAkWLys5kTSpPWt5DZ07q4VErCNAcpCUbA3DJDT0iCGEIFUTpptKtiBS-DB8SFyuOxYLPmZSOYk6rTidPdOMgEZvzhig7l__hHHSpmveouuRIrbFEopoWmaK92zq-fJzqxMBC5c_hIMfZRFlGW3PDKG7Qb96pGDbJ3_v0Y1plwNvTLVoQmxfhibJ4YE48vU2tKm7Ob1lBv2X6KHBdDLtTk67pLgFDtBzGte7SFJ7X9B0mX6VCBRXZEndwR-KnYzDwftpQ2tDfbED11hzA0-MnHvVl5KboDSDnUYXVlSmdDjGtKPyB41A44zWKFvzi2tJEpynmOFdCO8MUJzOSZWv-CddlS2yfwfC88ZhWiC9aJOmGVDhdjTBeVSkVYuq-6WoOOi&vjs=3&p=4&sk=&fvj=0
0,Angular Front End Web Developer,JMA Wireless,None,"The Angular Front End Web Developer will participate in all phases of the software development lifecycle. Finally, the person in this role may be involved in...",http://www.indeed.com/pagead/clk?mo=r&ad=-6NYlbfkN0ArBNclRdIj5Ii59gLTsfdMk0h8JlVR--LpFIklbbPs012X_X0aYYmgCIGLikcJy18GxmqXrnOfSl14MxNqEjorDXeLZYKtEQuVboFxQ6mr9g3i9z-VekXhFo9MRAQavuRXARxL1qyyUjy04CFitOtp_24ZYmjOFyuwYG7-coyxk2jkAO1q4o7abzJ2ulkMgLDfycNcIQN73MVCByVp5BGu9yb3ZZ1PvD30g2-XJglLqlEiLk882_a5LuEJFoEYutvH2twgKaLIRMl638XKgnp1wX26AKjxyQBU-XhRDhxR79W4FreCZfP-_XtN5f0aUuGJ8wmc_f9DdWRbYmrfIvHgotnQorKvDJEP6-ckus4uj-9lfJ6ZEzAYL_8j_hwvRi43TIrXyIWwdmATmk1Abf_nWmnT1NkjbxlDipj2-JkoZbzqgQyoeH2w6wumU0YYniPdQ4EtTnG5vw==&vjs=3&p=1&sk=&fvj=0
1,JavaScript/ReactJS Developer,Red Axle,None,We are very excited with the need to a add another JavaScript/React developer to our team. We are looking for a developer with solid client-side experience...,http://www.indeed.com/pagead/clk?mo=r&ad=-6NYlbfkN0DZiSTIZ_C6igoX3LIiFuxr7xHuvvgEM2tbiS4Qe0EvXuvo8YKkUWElCGCoui79ZUhAEKhy2Y0rxDSufoJ7Bw7t_cTxPfQc-lkPJrDkgRgdihYL0-oR1qeSW3i-kAPq0abqoWWbqnFgJrhVtGy3R_AtcWyc64hu3O59k7rXrvSDZ_ZdH0xfTRQ6tKIrz5qZJolwnOFbj74RetFlgm0ktJuNVOq_KEixlDkrQ6EMD-eSIIFSuXhngN9xCvs4Q9IDBrGqV2dQZAwuc6gWREDFbxidtfhxIO2peXlu6XyYYQfR_cf7Gr63oF8sPn5j772L5V0IyANj6BlsaK23Gx824QiksZ4NARhjbpShQO7uCg23R_B4PuiYhOrwNMjhlzR5d1UhWqfCJPhMDTeHzK5u8YEdHThD8gUQA1it0ij0b9JNUqROaUtyIPl4G2JeqAOZofE=&vjs=3&p=2&sk=&fvj=1
2,Full-Stack Developer,Arroweye Solutions,None,"We have an immediate need for a Chicago-based Full-Stack Developer. Arroweye Solutions, a fast-growing e-commerce company with a unique web-to-print technology...",http://www.indeed.com/pagead/clk?mo=r&ad=-6NYlbfkN0DV_Zrtib6KeVI-VzwrGT3-s_Oc84EGigj_AX89Hl0qziXo4bh9CBf499ZcNIYV1safhVMXy_nIaOANH4ttO-TwSvEKXob7x66OcGXNN0hVjztS1B6rV27OUnr3jHGuiKbsWkI0IPOcr-ajhqio973aqq0h7__v656p71UpcEBPwB7n-Ji-HXw4CLpetYCxa8-DdftZHbNK4jGdCgSBLlCT3mz4lRmZ-XzxkkHcbnXjfguhNADmZqxmjqisVzznL-7SSRAOzcL-dQSw4p8BegOu5s3DDH70_HaotEG9pSNGro9JKh-_QIj-wNOS7D6bVr2gtAFvlnAZ2C_DcKC1VstPSmVmIvfNUG6l-8I1osRVXTpmxhHD-dfF_PRq3-Njq5DaH8H4cjUnSkwLYIojC0uOIrvHfJi3p3Q1PmtetREen0czI4CGzNf6gg12BO5JtRP7EoB-yVhsuA==&vjs=3&p=3&sk=&fvj=1
3,Senior Back End Developer,The Washington Post,None,The Washington Post is seeking a Full Time Employee or a Long Term Contractor for their open senior back end developer role....,http://www.indeed.com/pagead/clk?mo=r&ad=-6NYlbfkN0AWCJ_wsjP2XpiEVpKxbmnSD7nn2vhw0wOf7OXX__gont9wv6yydfqJc8SLtEcEsQpDQiA8IDmzgRe7ScEsdOjLWOJ9m6pIUNTj4jAwicgobXGn-8ia8uW8dAGi0ZlWv1j7JErZldx3ocnjVLo5_aBiICf3k8zTY-7zHQ-hK8GBzZjRV24DoprfWXZ0uGXEqiNdEQAK6hx8F_RIsgg-Ya6zr-oaAdQ-K4PKqHRChKGauHuDuRFmCSlWZLND5g4sYwQLtcR9UwrgQFA3JmVaCtBZjUpPPHZ8eFQWDHWnj_Su17gZwZwiUiNBBS37ryoobK6w7aQefbm7_B2NmiYYkd05WiL__kyh4hi-ZzJQzVTTHkYywTZWBO0rY7PcPFFM21hZhtlyUjEJ1x3l413L7Eeh3lI3vpve1nbTvA3gqnKTCjqFEvW3Q25qvrYC25vcMhrPUHNYvkVtpqyCRP7y5YyLUWt7Gaj-msM9hQJUpnfyxKenB4wz9DrrAU3AsU9j_AN-86K-LVhLMzdtwo7t-YqiRbZ0lL0yTpYKcbW-fl3MEihI2H6G4v0Gkhbt6fXXNyG0w8kCaiQhgoYDQMlaTdKf&vjs=3&p=4&sk=&fvj=0
4,Drupal Developer,"HNI (Muscatine, IA)",None,"Design, development and deployment (back end knowledge is a plus). The Drupal Developer role is to define, develop, test, analyze, and maintain new Drupal...",http://www.indeed.com/pagead/clk?mo=r&ad=-6NYlbfkN0AD7xEDYgk9cjbiGGBcw7M-kkZ79ZCF6k3qV1pIuaRZSsWskgEtqTMIgoiLuBZOUXcE-jAx_FqjzUdw-eDG5jwTtGAQWR2s5oXc0OvCANSXABU-_-y84nytCP_8JZuhytqWHQsxyMEGfzLzks8O6pY-vV_UqKuAO2Ft2eyT807raChoGxcvsqfMLEgzyGUgDsflSBnUavd6SmHiQD1GEvfjAnS9zEXimAVAnjd_yvdXT-QhAFPabZR2yjCOKjErx6AnIlXZNZ4lUY-bsuDX1KxpzqnHlGbtFKwDVVLFFtVqCffyc0OzEUFdcXNZNO43qMYju-4_25Oy7R_1bZHCJeJaOoY2xij4o3tv4meV9h7QeloIm-8If-gA-9_lRO93BnAVvxFqSjiF1bTZeFDiXtXY0SAZUB8Nmj2ibM2GrOs1GRoGyTcmegViimtG3knccqE=&vjs=3&p=5&sk=&fvj=1
5,Software Engineer,ABC Supply Co. Inc,None,"This will include building web applications to support custom analytical applications, automating data collection, and working to advance our back end...",http://www.indeed.com/pagead/clk?mo=r&ad=-6NYlbfkN0B8q3Em5dkFqbAAiGwv9Tcw7fQz12nvIFj3JFCzxzRbkb8ctk06gNnFwBlE2b5eKlXDsnAKngWXIJsHf_AdWo_6MCWtuV7w4nN2QjoQnV3751SnsAa8OYWdxdoCMP-0gD80zI3NVbYUVD2O8JtoeeuMT3Sna0syj7x-769lYEcx4XMf81n6--ostWvdYErQKLUXCRUVB1Zu3UK5cY_Rd0IsFjR_1Or8Vi7uHC_kf-YuD_bClh2AntfeEw-SOI2q5gCz_jc8q3d9NXoyrPZKVcvS9lOYr-_UBfNi6zceDvHYbjgw9dZM_Zph3rjJBJiXGW1OgfYafaxytNZZkjGpwiU8B-08OaqXJ0A-eQ9G4YSXAV_MV__lrI3JZmfiBKdgqWPhj1xeo8jcv87gs4LRGeuk5sTRhSTR3J19u7vPf_Uai_dfaup9gUhrxd53ZsYxvQVBkOYqnS2XLpOkDwhOK4lGWKBFosiGa_kcrvMMTK6fBpNMcixUqUtoBUvxrqvXLVQQ6OqEiBGKIyKBf2k_kGc_8vVKvhBlSvdBbsyqhNuDKKK_9eiD-1ZxKQxyKTaxqyWu-tcY7q06hg==&vjs=3&p=6&sk=&fvj=1
6,Junior Back-End Developer (Part-Time),Chicago Architecture Center,"Chicago, IL",We are looking for a beginner-level back-end developer to assist with some upcoming projects on our Web team. Come and be a part of our transformation!...,http://www.indeed.com/rc/clk?jk=ebd83841f20c9293&fccid=313bd052ff7f4c23&vjs=3
7,ECommerce Front-End Developer,Advantech,"Chicago, IL 60638 (Clearing area)",We are looking for a Full-time Front-end developer (REACT JavaScript) who will be responsible for transforming the design and the product vision into working...,http://www.indeed.com/rc/clk?jk=ccdbe175f35479d0&fccid=36dabe1016fe6813&vjs=3
8,Front-end and Back-End Developer,City of Chicago Inspector General's Office,"Chicago, IL 60654 (Loop area)","Applications accepted January 7, 2019 through Fabruary 4, 2019. To apply for this position, complete the application: here MINIMUM QUALIFICATIONS: Bachelor...",http://www.indeed.com/rc/clk?jk=4898ff9d8640011b&fccid=499dbb5824c5ee32&vjs=3
9,"Software Engineer, Back End (Chicago)",Pandera Systems,"Chicago, IL","Pandera Midwest is seeking a Back End Software Engineer. At Pandera, we leverage an artful blend of analytics and product expertise to create beautiful, user...",http://www.indeed.com/rc/clk?jk=b17210988136f67c&fccid=505d1fb00d86d35b&vjs=3
10,2019 Entry Level - Technology,Northern Trust Corp.,"Chicago, IL",The developer will participate in the complete application development lifecycle from concept to implementation to support a range of end-to-end middle and back...,http://www.indeed.com/rc/clk?jk=99cb438d50877b82&fccid=659d7ed1b53f4cd4&vjs=3
11,Report Developer,PREFERRED HOTEL GRP,"Chicago, IL",Act as back up for some Database Administrator tasks (i.e. Provide end user support for reporting tool usage and data interpretation....,http://www.indeed.com/rc/clk?jk=fbd22f7ebc8a2ee5&fccid=e94db1c761ae1e54&vjs=3
12,Quantitative Analyst Intern,Group One Trading,"Chicago, IL 60605 (Near South Side area)","At the end of the project, you will present your findings to our senior managers and traders. You will work with a small team to form a hypothesis and back test...",http://www.indeed.com/rc/clk?jk=504434a8c2699ae4&fccid=d0982e2bc11a2311&vjs=3
13,Front End Developer,Neighborhoods.com,"Chicago, IL 60290 (Loop area)",Front-End Developers are responsible for developing and maintaining Neighborhoods.com as well as our other products. Specific tasks include user interface...,http://www.indeed.com/rc/clk?jk=d1d41787f22f2c97&fccid=521ab11724a3d838&vjs=3
14,Software Developer (ABAP),"ifm efector, inc.","Chicago, IL","We provide the full, end to end value chain in cutting edge Industrial Automation spanning from R&D through production into sales and after sales services....",http://www.indeed.com/rc/clk?jk=06f843d3097799b7&fccid=1a9b0a26c57f989a&vjs=3
15,Front-End Developer,Enova International,"Chicago, IL","Comfort working in Chrome Developer Tools or other similar debugging tools. As a Front-End Developer you will be working on a wide variety of projects,...",http://www.indeed.com/rc/clk?jk=23f47792b80e3eee&fccid=da5a2426fca0c292&vjs=3
16,C# SQL Back-End Developer,Paul May & Associates,None,"C# SQL Back End Developer. Looking for a back to front end (primarily back end) application developer. Please note, while the client is attempting to mix in...",http://www.indeed.com/pagead/clk?mo=r&ad=-6NYlbfkN0AtmmgL-6xvNJ2TgfBOZULzFUyk3B45PtfzaCI94ECTxEQtAyV0_t5_eq292M2JzUrX4nQ9iEQeN-cZlrquYl3R2bICHA10XayE92RKTfufyUiUcoakqBKXoXmhWrc58QJ7lrXpDE-Ejr5zafJv1d5XcSpe1W419A8y41ZCmJZQ-WS4ndkO-yhEIWztnaCHnuHPsHC2GDIcXPIr9bpIWqSxUvCEqdXyWbGoP6Bl55TdfnwzOMniXXChxRErNDC98orNZu6q58zcDbYhcfX-KVVBKQ18dXHUaGrfa3ovztBuwBHDLWmVDJlJLu2jpf9aqH3P-0NyJ4jwL2tup-ig7XSTzA57pcqIroixafVX_OhV0Aztyw-aVbo10WkTLv9JypA4iq3cWoj9EihIHEhdIuvsIoUlPydcScfh1kuWQLLYi565P5mZuABbE3-tip0qaVZcg5sZ_Z3lKqf9-O3ItwWGK2afyzcZHx5ylbvKxHQiWUf0NVYSsesx6UvMingfjoJ9M5FqmZMJ421mM2SAkljXiKh6MZX4rjFphJvLY1upxygNwHq_MFxXWDrsrIFXnZ8imanjKREbXP7Fy-mM-AgIYnrCJxJCdT4HXPB5bumVD92LXgo3KaLnenAeE1CYUKfsCNgyQEXEkymdzshooL8L4_HBkL1OpvUc78ZdPm4VZuurMhg_NT8k&vjs=3&p=7&sk=&fvj=0
17,Python/Backend Developer Position,QuadW Technologies,None,This position would be for a Back-End Developer responsible for managing and building a new data tracking system.*....,http://www.indeed.com/pagead/clk?mo=r&ad=-6NYlbfkN0C5rQVstiD6WilaW3nxToY0-OXldgNsANMtHR9TS72hNRKccyy_-cdEqkEU5QtpFHPGsiGUrD42u5b3r6Vd-Eu8TgQ11HvL6Y_W7wWSIxelGv-C1WOG42TezZf_UjchtZfa43q6na9rniSCIpeBOjAwBxVNePYs47UP7q69jGhLhyiDpj_bCPBZL1MjkPLij39y6ljaVmOVVGt8J2wbCdyooJH_sALFgKqxRnj0jPwAAJ7G8BGy-lVIqaQ3aUwcas9kKlUiOyVHQw6luNQ1ANxjoHd8hBzU6MLJv0P_tRCa7RjTGD7qTeXtvfS7wq9kHtZ4ksHUZESXc4OdXsyMJXqeJZs2do4AFApRS8PaGn3t6epE59as593cDk3_H0dJqhQI5IEbA8hBbKUes0asq7p2u7lEflMWwLehviqJetOjip7zsyo-vsBSUFTYeU_g1xokqIbdZc_IhKHzO7aKE3Ao&vjs=3&p=8&sk=&fvj=1
0,Front End Developer,Beekman 1802,None,"Beekman 1802 is a hyper-growth, ""living"" brand, creating distinctive artisanal and ""Farm-to-Table"" Foods, ""Farm-to-Skin"" Beauty, and artisan-made and inspired...",http://www.indeed.com/pagead/clk?mo=r&ad=-6NYlbfkN0DUbYrnSglAm4tv4kNQdCOfaR9mpBgImTwU6XSVB_maVuEgfwR3N-y6F3s5pdVTlPQbygTBRd__j45P61BF_ApzpGywk__k26pOmqlUQUaYXp0hxZP4MDWGlqyXGoHucs-2Rnn5o23pcSzbbyyymOinAiVQSmBi1kPTG3SnzPKrAzaGzlAa-pq5o1zBW9ZV3ElzXhP7IVOAHZX--Yt5l6AqW7XTRQX4COvhHipw_38k8Um0WbNrvhrMTnsrLRCu_tcj5-aTZKF0feQ-xWRqzzE01y3EqkVr67h-qb8HDOGL6xiXpg-NffM_xeccRUuML7P8PgZRCf1fU1y_74V3F9qhtW3EfNmRojoZLDLAZ0XhRXiMCAy0sti9L0b7W9Fc0WpFgiMFQu7RfW9LwlnK0GH-jd7tYB2JW1u5jLNCPR5aGHyBhyVv-uzRk79ynh81tfU=&vjs=3&p=1&sk=&fvj=1
1,Software Application Engineer (AI-Driven Web Application Tes...,Appvance,None,"Your deep technical knowledge of HTML5 applications, front and back end, is key, as are your strong and thoughtful communication skills....",http://www.indeed.com/pagead/clk?mo=r&ad=-6NYlbfkN0DGwhwYHwL-e6KdDqyQrsrdTvahay-oTjI12dZKcMlGfjO_h0PacNSge_DcgH_TO-LBYIs78A1QCEP9ChO-DEWF7DQRYgu0FfP_ZQvmMXmvVfHudwaEJNKrew-aQbpOHwuGU7Pxc5U2F5rH85mm9c9nLFGGltgHzbUeqUdTLmfKmlfw7gEXxTxBYjsOf2gYc1nm9BEE4WKI3qC0VLi2oNOeLyPwNeRQkpTrApeiWNURZfd3sFJ_-oKLv0DWrGzYpo_nAcbr2PXjvxOpID56g2ThN2-0QeKEv4KUgEWBPLGSh3UsixPfTUYkMGuo5Xol-M9QcHx-HTLgDcqCUi_tdjyk9Ef3KOC7CburSOq4gkpZMncg1J5lz-oWrLTQ7bczwFmsGrYGHWmTVZbw8mH9oJUp9X71jdrtG4ESpjYCgQNO4wEtdYQZp53bBNhxtLIe3aslCDs9Eu-9hcBiK9g-chGJkYjcT00oMPVXRTSGxtz9I27GM2jHUyDG&vjs=3&p=2&sk=&fvj=1
2,Salesforce Developer,Automation Finance,None,We are seeking a highly ambitious and hard-working SalesForce Developer to join our team. Salesforce Developer required to work with our lead engineer and...,http://www.indeed.com/pagead/clk?mo=r&ad=-6NYlbfkN0DnQYTKKFWO9s73pys_NWiIY3xVgCHjXwwZbrxEbhOwd5D0349e1VOq0RLUZ4f01rRWwQdFeMu71Yi77PmeS3CP8BEa1kgs6Z2xLbTnrZguXiCiMnVDNGT3V624_KunqVlmPfQub0U_koVF6-VXGrUcI-9gjWjIddoik8sBNwTzglfnWd8qKtqgg7Ux9B-qSZDd_sHYLGJDY6FiLU_cg0dMRK9RjjK-rraGWIiSVrnXtSD5NlAvTT5RipYPnwQsg5BX5di2cqPmtgWzeyp63VxyugFAXeVTsC-xlbufTbWLgBcWJTJy1_NBujUlk_8EleL7yodSxSN7JrqrmUaQjd8EQknO0SA1xQYS0iQvynyV0hq1v64_OZJZicTf6Snw2REtyLzbobKIw2Vp60okiLWfipptw0bVTBQi1wNd_XObkIqTcMOmB1jACjeOBpFFEGo=&vjs=3&p=3&sk=&fvj=1
3,Magento Web Developer,TileBar,None,Magento Certified Professional Developer. You will help build the future of this company as we continue to enhance and develop our front end & back end customer...,http://www.indeed.com/pagead/clk?mo=r&ad=-6NYlbfkN0DVwJQ4nzCOp6XyKbCv0JG1hmyWAGBF0BYVaL3CcSb19Y3ip_hp8W9yAeTm0V_YqncmkgauhuSwhPzGzsOHiUD_z9U6MEHMTzUhX72dhc98K80s-LvpGHMi6g5Ig6VQ2Eb-NoIyGqRH4jQIGCfFsyR_QvQIIdsusgN5AcE9jH_qEQX1-ZeZO1z8WN5pCTDD1lpm2Ei1ETPPBtInODEOoMWgO6KZX5Qy_CxIPCz2qrlp4_GBzTs-DqfIeBTSSWdjDzsQLy-v7Acs4uoH09KkI6S_YeQN_7aoav4gJ4XSZaL8n_RltUCmh8QjPsoDBdfIG_VOEesJUQq-c4k7VdcfCLMey82SkRzedeSiaDgowqjlpWTudzr9c_9NEA4WgSdPs4vINuzTX9ZJ292w16IZmgSozL6TUG3BrFObppUQ2mQz7TXTkySqA1dBps1GUZiD_5I=&vjs=3&p=4&sk=&fvj=1
4,Android Developer,TopView Sightseeing,None,"Developer should have worked in a published mobile app. This position is for a full-time, on-site Android Developer with 3+ years of experience and a great eye...",http://www.indeed.com/pagead/clk?mo=r&ad=-6NYlbfkN0DsUtjlO9aSzLhbbi1ylmhZb5HDIaxKOqM1Q3G4JftrQksUBU7v7mm5puY_noXBD78GvzuP2e7L-zK5c7Ylbq5vVGfxU1Ot5JPGxwKO33G77YKMgdosnyS91ye0eiM4VwzSX5CTjUP9iJhfnRnXB5Fmjikb80fZHKpAiyMK1Y-re3iI3b63dYL5mbHYRmP-zA67PvzSVMdO1DCexF5Xps_5r6C3z19UkhtTZfu75knYu_x1DNB0W8h-5UwJfp3yJfGowxxbn7BeEqKrn1I3rJ5aHgZO2ncc9d7jV0S_k4HXm9gY933-w-VRhakopVqjx1EPh8FPUbJs4ZB9bRfIv5kNRGvUKk9wfl665SlePfE0tC7fmBTXUZy77EDEy69AadJ1x6JglPVwnJH5VmB0aOCgGS9bdjxLNLiStBY2F2cs4k2FgHcpspxQTdMpJ0d2YrU=&vjs=3&p=5&sk=&fvj=1
5,Entry Level Software Engineer,CloudServiceTek,"New York, NY 10020 (Midtown area)","Strong knowledge on Java back-end and front end. As a developer, you will be responsible for coding and maintaining the development environment....",http://www.indeed.com/company/CloudServiceTek/jobs/Entry-Level-Software-Engineer-02706113ba30d8e6?fccid=5de1fafcbe6b6997&vjs=3
6,Back End Developer Internship (NYC)- Summer 2019,State Street,"New York, NY","Y ou will be paired with experienced mentors, participate in job shadowing in an area of your choice, and be part of a multi-disciplinary team of interns...",http://www.indeed.com/rc/clk?jk=0cb750cb2bea0723&fccid=92f1ccd9154b0139&vjs=3
