,Title,Company,Location,Description,URLs
0,Data Analyst I,Computershare,None,"Interacts with prior servicers and investors regarding SLS transfer requirements, data discrepancies, missing data, files/images and timelines for servicing...",http://www.indeed.com/pagead/clk?mo=r&ad=-6NYlbfkN0C6MWAx06RHPhT8Lk1LTJ4ojNgANd7X1UDwc5g6nuQ2rw7oovaQZJZLK7eG3ROxnqn9bgCpOhtgBtTDoJ7y67KaSNIVZHJEOJ_Uf479MpgMFfoEa91WmsLLsJIqooI4NRjQWChn-gBU2gsF3ONJDRvVFSX5SGEAa3x4kZYI5aeTQDoVpwFeu7ykS4splS3wvJ6GYOGBu64U7xj0jk3WptFg1vkBafeztul6qJNnnKk1c19fCaKkYlaetARJOdTY9JZ6fVyigwKS1eUz25rlqU9Ih2IldCHGtlmZp73NilC4xpOI4iaHxLD-9tFmxNEwGU95meVmFztKQ62ADYkqDzxcYp-ZgyDV3mcI3fA_ZYcmC6HC0BZ2UOWg1EE7zBa4y82CCyekVsGlOUXIyPf02bQkUlxDkpht0sxk3NNNLYiOwGxQ7VlIKnYqIZOJ2dEPSDcUO6uRqeOXMEWHVbE6n2DhhFe68lqw49WmxPzFoHrCqZr1Lqoshwf3w0Gt9a60vJc=&vjs=3&p=1&sk=&fvj=0
1,Data Analyst,"AAS Services, LLC",None,"The Data Analyst will help manage large datasets using Excel, assist with data integrity, create both standardized and custom reports to support the Financial...",http://www.indeed.com/pagead/clk?mo=r&ad=-6NYlbfkN0DcC4OtZSXeE-VUs2w2ViayACLeT_05LZi5Sobw2uMnpLkG6zTGvol_vk9emwcUeKJUfsI-6I8mJIgPhcMW7jGnp8PKCC75GzEBgf4uCBYSBSOXHHlIeCqhbctiZFwbgZwotD1biCgAhg6I_BzuhPraNGVfUCTJERwjatqrkfR5rI2KklHoDMG9NZzlBA49GHkgCOAcFeKN9PeVGKjp4cHcSyzkTQgMV4s3vYAcfpdQjc30w3iHwrCXU313oZP336y7_3IN5O7APevSZgrKlaaKcCGOi9LwiKq1WsP7PPzhQ302oKUBI_Zl9FS6jyTmP80kkn2cZqN9o6xE8hQC52VYM-87PHDciBC_kgUwCvOrgW_aJS5cBKV4adP0q-rj3Lil4vpN3mhFnnTC73P5zfZouLOR9dDfAnOvT0yMMhdIYg==&vjs=3&p=2&sk=&fvj=1
2,Digital Media Analyst -- Recruitment Advertising Agency,KRT Marketing,None,"They love using data to uncover secrets and trends. Ability to evaluate data, identify trends and effectively summarize information....",http://www.indeed.com/pagead/clk?mo=r&ad=-6NYlbfkN0C6nKFHSiMBxFBp_E9a0ZdPCM_qsZkYnNiPA1S70PNI9T3HEWqjoUFh1lgQrkJNukQvOy53LUkMJFmvrJIieWjhcSMNKDTfQSD03cEbqpSAp-r_atpkTZwt9fKAD1LC9z2lWY0-Wc3QYD-x69gcS3lrc_3PwomQefdCIvrqK5zNg6qzEz019C404mXtpeZg2nnt8RXiuQn944wyme6fxh-mDKIQokOT2-uZ_88FwAypg3NWp2EeoqbH-SGyKrBozGvds1_WaYgGPwVc6uL73pj1LmaC733nrkwDY00ql-MqD6xJIRV2M8CdUOaSpjoSNZ1SHXJujfJ-uhqMNaBcHufFKJ7ESbgpsBzqMY2MqqUt8sOSj23X4kGbE4Yg2-U-FvpIS5TuW3kZBkLlBMbWGZSvgVeXuOggEtkif_UQoe597-Iv2e65LJZx3leq9qSvY2XYXnDxJN7oxkR0noBySZ4T8NjvCGybI3gO0aGbIVR9etVzPuwFFfhmd7uv8gB053Y=&vjs=3&p=3&sk=&fvj=0
3,Data Analyst,System One,None,"Data Analyst Responsibilities:. System One is currently seeking a Data Analyst on a 12 month contract position located in Denver, CO....",http://www.indeed.com/pagead/clk?mo=r&ad=-6NYlbfkN0AXtvPDqDev6liskt-h_3vAUEMM26GmMOlWYCAn-kvNiUi5G7u_kl83ij3MBc9xpSS5slRBFCS90zSBZBT4QELOqqbUXS8KnvaJp-GnVbOOIyOMHmDNgBv1n7W7CEs9DFJLQjSZWJfUYZQqWdB0HRvQEWznkgtl-nng4jitN-AH8Goty9Aul6yH3N8gBqpSzmauz5JwwgpcAOtcvDwx-5I4s_0uZJZLI7NGaRr1ExLsXMsXYTemOvV60QYilnXBZE10zVBlaw6OOaBwR24rFhQrvi83yDiKc9DcuYXb3TqdDxwNHoGzaUZPgvMNfK6wRXywlnCdJUC5Vl7-NdHiLmaX1Itk3sw-J3fdwr3a3vS_POpAPdw05apKzFsiMHVntGZjT1vQF0FVmoUFl16dVLc7JNxe6GPuGzUZZj2WA6pEACDGgQhiyUjAnsf_W9Q80x3s_SFt6O5LUM-f3tdq07mt-igfuMUa7oL8rAOzFWiOF7QfuXg-4jimWEUIdRIUI6m5RUfMTivuZGrKFWI2Jv_s&vjs=3&p=4&sk=&fvj=0
4,Data Analyst,DaVita Medical Group,"Denver, CO 80202 (Lodo area)","Over 5 years of specific experience within the healthcare industry. Responsible for collection, analysis and maintenance of data focused on the department's...",http://www.indeed.com/rc/clk?jk=07ec58ba9cfc0c32&fccid=1a24bb600f1a5aa1&vjs=3
5,Data Reporting Analyst Assocciate,Children's Hospital Colorado,"Aurora, CO","Gathers functional and technical requirements to design, build, test, deliver and manage data repositories, reporting, ETL, data warehouse, registry or data...",http://www.indeed.com/rc/clk?jk=3032f5e9fc0ac4df&fccid=098552e8f8353e68&vjs=3
6,Data Analyst,Concept Technology,"Denver, CO","Our rapidly growing staffing company is actively looking for candidates who are skilled in Quality Analyst,Business Analyst,Data Analyst ,System Analyst &Java...",http://www.indeed.com/company/Concept-Technology/jobs/Data-Analyst-b5e435010bcdbaa7?fccid=f67f16d4706e99a4&vjs=3
7,Associate Data Analyst,healthgrades,"Denver, CO 80202 (Lodo area)","Identify issues related to data, data sources, and data processing. Healthgrades is seeking a Data Analyst to join our Data Science team in downtown Denver....",http://www.indeed.com/rc/clk?jk=86378693ffd7eecd&fccid=4eb946b850ff5481&vjs=3
8,Data Reporting Analyst Professional,Children's Hospital Colorado,"Aurora, CO","Creates data products, data visualizations and presentations. Identifies data sources needed to produce required data sets or reports....",http://www.indeed.com/rc/clk?jk=58846f0756f508a5&fccid=098552e8f8353e68&vjs=3
9,"Business Analyst - Denver, CO",Anheuser-Busch,"Denver, CO",A Business Analyst supports Field Sales and other Sales functions with fact based data to make informed decisions and recommendations....,http://www.indeed.com/rc/clk?jk=2218d75cc3812d40&fccid=84c67dd9d990e840&vjs=3
10,Remote Freelance Data Analyst,Cardwell Beach,"Denver, CO 80224 (Southeastern Denver area)","Cardwell Beach, the world's best new marketing company, is looking for a data analyst to join our team. Ideally you are:....",http://www.indeed.com/rc/clk?jk=abd4c090c483bb3a&fccid=d505a49d7eb33485&vjs=3
11,Data Analyst,AIMCO Apartment Homes,"Denver, CO","We seek an innovative Data Analyst who values relationships, has great ownership, and lives with gusto!*. Strong Data analysis skills, utilizing SQL, MS Master...",http://www.indeed.com/company/AIMCO-Apartment-Homes/jobs/Data-Analyst-d3bd227fcbe6d476?fccid=66fcf04124de3699&vjs=3
12,Data Analyst,GigSmart,"Denver, CO",Data modeling experience. Acquiring data from primary and secondary data sources and maintaining databases....,http://www.indeed.com/rc/clk?jk=cba90e081d32781f&fccid=e5a2516f4b808a1f&vjs=3
13,Data Analytics Analyst,"BioScrip, Inc.","Denver, CO 80202 (Lodo area)","Due to our exceptional growth and success, we are seeking a Data Analytics Analyst to join our team. Ability to define problems, collect data, establish facts,...",http://www.indeed.com/rc/clk?jk=09be3750cb204ef8&fccid=f61ee5be7d43ddb7&vjs=3
14,Business Intelligence Data Analyst,DISH,None,A successful Business Intelligence Data Analyst will have the following:. Provides support for ad hoc analysis of business data....,http://www.indeed.com/pagead/clk?mo=r&ad=-6NYlbfkN0C9zt3h-1m6bf2vd0aeIpT1kGfAO4ktZvZfx-NeGJC9DQJITD4XQNlD9iunlpc89XEKah1FouNaE3XVtiL96YA117nELEBRegMDgcZ__9SLuXcAwJidSAbf_6fsbl9oKQVbj31iRdPt0Ba8YtUSKpF63c-BQMUFyi0NScboDxPoNjG1uBNo5Zel7P7eKMIt1OOvp9N4oCo7H4PAu-4Uds5-UfKIw6VjTYPCnZ4hsQvkAHrjNFhX6ivI1Wyeo0QcDkMuzxBSUEZr1z5bKv2xV8skgoJAypZwYKG6HG4P_mGzqtXGtKZeWkV0g_YDitFLjdgegUx9Rf8Zm0cvjKLvoyFkAIwcB-IIeI_loIjBGmPW_lRLBuQu-YLv92Jn0cD46WTSunU5qROhQpiW0sOvJTq4&vjs=3&p=5&sk=&fvj=0
15,Data Analyst,ANB Bank,None,"Manages data quality of the data warehouse, working with technical teams to ensure confidentiality, integrity and availability of data....",http://www.indeed.com/pagead/clk?mo=r&ad=-6NYlbfkN0AnZiEHv30vA33BBdBk0Fk92wxRNnIxyAQtUp0bpAb-wezybR20RLSuhc1VTLLs8cP8Bm2qLLtD9XwdBsonwtprYJ6OZmDIvJu8EodqXD1_cBLpAdHml_x2IXJIUa-HCNF6n3Ao17gk_Ty77b_Gv-ora9nB6VCEgaWgOY5SQM2QQH1U8iJMSQyHaZLjtXaJheTMwXlPEGLnRgJ6GRPCCPixklsx3zGJY4PYSSKzPNTJbvsl0gkTnW6muqPtlGd-5goyFcg9QFw7N7FifUYfuNM0T0ICnLG7FQqWCsTiH4AZs5HC9x0YNuWoQDhbZ1DLUTVfNLrEgtqBYpMncI9pmMaRjXBXqyTSICWSFtewMQFVyG8WwMA2Mr9DmXMb80swfIm2r0qiJeWdrUizGesFAjRy7ow9wxQ3qtb_bkgG4D6drRj4GqIu0I_47-zM-iRLJ0A=&vjs=3&p=6&sk=&fvj=0
0,Data Analyst,"AAS Services, LLC",None,"The Data Analyst will help manage large datasets using Excel, assist with data integrity, create both standardized and custom reports to support the Financial...",http://www.indeed.com/pagead/clk?mo=r&ad=-6NYlbfkN0DcC4OtZSXeE-VUs2w2ViayACLeT_05LZi5Sobw2uMnpLkG6zTGvol_vk9emwcUeKJUfsI-6I8mJIgPhcMW7jGnp8PKCC75GzEBgf4uCBYSBSOXHHlIeCqhbctiZFwbgZwotD1biCgAhg6I_BzuhPraa2hefcsLb1ntqMJl4EA7TecV4H0uCkdIeLk2C4JFZUI5XuDOzEYQFpOiikc4SGoYExaG0tRI7ySgwMzgGLPiYx6JT3zLEOPRLwfOxOBT8a3cagV3rtQPhnREyEpMVC2TXgC74JHU1eHoypCTOWcgpf0SbNatJPX5pHPu-PHoFQAA5Mx05n8i69mU9Dus3GjeUsz6FzG-qHk79P9yN7T2oGWPua48tBiQcifwONZHBxzUa6JcgZdwwRsaqPG_p78YMT9mR_JSi-STuDkTpFqAqA==&vjs=3&p=1&sk=&fvj=1
1,Data Analyst,System One,None,"Data Analyst Responsibilities:. System One is currently seeking a Data Analyst on a 12 month contract position located in Denver, CO....",http://www.indeed.com/pagead/clk?mo=r&ad=-6NYlbfkN0AXtvPDqDev6liskt-h_3vAUEMM26GmMOlWYCAn-kvNiUi5G7u_kl83ij3MBc9xpSS5slRBFCS90zSBZBT4QELOqqbUXS8KnvaJp-GnVbOOIyOMHmDNgBv1n7W7CEs9DFJLQjSZWJfUYdDq7TmS0-Xm9pO_6YF60Y17zMM_KM278BM1X5cwRtwPKPzI8yPaRu8tzZPWVygE5nTek07CdhzeVLRc3AYHmswEOLAd8jEYuek4PuqQZDHgJCdrsbxhygN_4S46B1I4uMR07sw1CMYEq3Pa75YLzyowxwWBl5RgNVBCoU2gnZfLhx4bM950Xwb3Smm9fqopqsFH7Mj-pFMISwyC7emCRP7368NQv4aq2-UfDKCfvkn8xjWFk93RTXzhVdWY8_fn8wuiKZWAN0dwfnd9o6GSmfHm3udFbqg9OCwjq51TTIYHObfLOQQtkPmoqg4AYpMAjeBXdMSHnPK6t5UaIUB0CO1KSShmoNe0AqyfcF6EiimUy7ledwYons-d6lnPLWrSMK26r3yFiq9M&vjs=3&p=2&sk=&fvj=0
2,Implementation Analyst - Verity,HealthStream,None,"The Implementation Analyst role serves as the transformation leader for our clients, independently designing and deciding on the automation model that delivers...",http://www.indeed.com/pagead/clk?mo=r&ad=-6NYlbfkN0BAWbc7Q1165t9pufWZKv6t4AtynM8WkNN3TOajL_P37zU3yIaGBDV3ETzP_uuKdRGnBO9O7UBtmoG3Dtr0FsE7gnxs9JKkAiA2gILzjeWl35xVaafA8nUJ7KuL4ULFQVRnkf24n9KsW5ZFCMtjso1ESUVdsve5HAdFI6EokHRwoISMrpdHKK8vEQP3mo7naNsazCiD1S87JHOgWw99IVbDWN2Md5cP6l9j_AFu2uqWAwb8R7YxwPginP_RcHAN9hi2x1kRFhTy3fZJKLScEZ3HnjtFk3lFazT-rReq9nMjoAUNOStYxEjpo00bAjz6G8FV0O8rsFVtTVzcQAhBLUWUN8OaAkDQamDsXkNfJkUCo1z25jXlcrESlGiTmw39DBYGx80qkXMVWsHmmRsJqFko5J-I1Ac82A9NKF8Ir9cqYuSGms-3bVcurq0dyvSCV-ObOFx4SDSLseEFsW1RsPP7eFKbc2KVAvCrfib0NGgcgCrgPNoNACQZttX4_002n79whdFhGjvS_0LR7qPYMltEIvQ250EKwWv5CJgAYB-KZvDXf_kiTjM4IlcTC6Pg2Ifi9Monp6Er_ZFq5DvLMecVY4k_0aFzyroLKUdQPgV5luO8Snm3wIPp&vjs=3&p=3&sk=&fvj=0
3,Associate Data Analyst,West Corporation,"Longmont, CO",The Associate Data Analyst is responsible for performing the following:. Must successfully meet minimum score on data entry testWest is connecting people and...,http://www.indeed.com/company/West-Corporation/jobs/Associate-Data-Analyst-cf9644b298104520?fccid=b2b9c1092824ddba&vjs=3
4,Human Resources Analyst,"Boulder County, CO","Boulder, CO","The Human Resources Analyst will focus on many specialized tasks, including employee relations, data analysis, and special projects....",http://www.indeed.com/rc/clk?jk=11006fa238ca1822&fccid=57f8fde8d2b7342a&vjs=3
5,Data Analyst,Concept Technology,"Denver, CO","Our rapidly growing staffing company is actively looking for candidates who are skilled in Quality Analyst,Business Analyst,Data Analyst ,System Analyst &Java...",http://www.indeed.com/company/Concept-Technology/jobs/Data-Analyst-b5e435010bcdbaa7?fccid=f67f16d4706e99a4&vjs=3
6,Data Analyst,DaVita Medical Group,"Denver, CO 80202 (Lodo area)","Over 5 years of specific experience within the healthcare industry. Responsible for collection, analysis and maintenance of data focused on the department's...",http://www.indeed.com/rc/clk?jk=07ec58ba9cfc0c32&fccid=1a24bb600f1a5aa1&vjs=3
7,"Policy Analyst, Climate",Environmental Defense Fund,"Boulder, CO 80302","Policy Analyst, U.S. The Climate Program seeks a highly motivated, analytically rigorous Policy Analyst to join EDF's Washington, DC office....",http://www.indeed.com/rc/clk?jk=d0075534b5e4b487&fccid=1514f8a1c4147615&vjs=3
8,"Business Continuity and Resilience Analyst, Global Security...",Google,"Boulder, CO 80302","Analyze data and assist in identifying opportunities for strategic improvement, mitigation of recovery gaps, and resiliency risks....",http://www.indeed.com/rc/clk?jk=dc573eb3d2a767ec&fccid=a5b4499d9e91a5c6&vjs=3
9,Customer Insights Data Analyst (Green Chef),HelloFresh,"Boulder, CO",Two years experience in an analyst role. Qualitative skills to understand nuance behind the data. Analyze data to optimize the performance of Green Chef's...,http://www.indeed.com/rc/clk?jk=04b0e75b5432a4d7&fccid=d945bab513bef0db&vjs=3
10,Data Analyst,"AAS Services, LLC","Lakewood, CO 80401","The Data Analyst will help manage large datasets using Excel, assist with data integrity, create both standardized and custom reports to support the Financial...",http://www.indeed.com/company/American-Auto-Shield/jobs/Data-Analyst-9dcd071561a10cd1?fccid=65c064b303926a05&vjs=3
11,Business/Data Analyst,Tundra Restaurant Supply,"Boulder, CO 80301",The role is part of the Project Management organization and will work on multiple projects simultaneously to achieve goals by translating business data into...,http://www.indeed.com/rc/clk?jk=6b0157a74c228a3f&fccid=7af2bd7e1bc3288d&vjs=3
12,​ Market Data Energy Analyst,"Ascend Analytics, LLC","Boulder, CO 80304 (Central Boulder area)","Background in data science, data harvesting, econometrics, statistics, time series forecasting. As the Market Data Energy Analyst, you will be responsible for...",http://www.indeed.com/rc/clk?jk=bfe0a1f75feeeb7f&fccid=2c6337eeaa75c979&vjs=3
13,Data Analyst - Verity,HealthStream,None,"Verity, a HealthStream Company is looking for a Data Analyst to coordinate, plan and transfer data from client data sources to company software products using...",http://www.indeed.com/pagead/clk?mo=r&ad=-6NYlbfkN0BAWbc7Q1165t9pufWZKv6t4AtynM8WkNN3TOajL_P37zU3yIaGBDV3ETzP_uuKdREzlHtqJHJWS7Ot4p0--_BlC0WXRx4lR2DrQTVStNmVzDIzoUgjgr5Om1UucW7mNovekRxfZeD8GvlAT69Mx6yiJfCnTMsGWUHmzk-0QbzXk2lEP98VT1dbetF_g9hDJqpx0wVmToCo81SjiOc96gIJdGcwaa01x2oi2qHooYVDAlhgK5YS5HmE2lSRjuNAugIsZKBcbU_GnP6mIRtySfS-Gz99E7mgWVreWi6hlpmXiI4CQM_YqLTlCsZTL9IAfmkCVFAC9dZItEVeSnkdlqluunfKRD9E9VQ3QnMplHHaQgp04Rn4agXf1AZd4so6zdyJOdXFXgzaag4adyFObM7E9gTvZ1mOxnkZncffdgTP56NTbCbMNm_Shdu4Bk0pyVMpD4C1aIXjf1TGYje-7MuTvwRh9RSvRdA8SKBzIf_adtkuPLYIg1avujwsbDuOwJAjMgdB3FQZJII32GlyTHUdDmEnQHwndRpH8ltrsZefzdgvenncVfx-Wq42uUeRkEz_9PXbd0ZBMShYtyXGaBZQZjQOnfvL-0fUr399QFcNkQ==&vjs=3&p=4&sk=&fvj=0
14,Data Analyst,ANB Bank,None,"Manages data quality of the data warehouse, working with technical teams to ensure confidentiality, integrity and availability of data....",http://www.indeed.com/pagead/clk?mo=r&ad=-6NYlbfkN0AnZiEHv30vA33BBdBk0Fk92wxRNnIxyAQtUp0bpAb-wezybR20RLSuhc1VTLLs8cP8Bm2qLLtD9XwdBsonwtprYJ6OZmDIvJu8EodqXD1_cBLpAdHml_x2IXJIUa-HCNF6n3Ao17gk_Ty77b_Gv-orULUPSjlfUyNDT7GW2cWjRiWO-3WRuAixH2bA2QBZ5h7geFuZq3g1gGgbAtktZaDi7luXF3xEQVCcCH6X1y3KeALM7fKtuZ2Ye9_xftHLThyefxw3QJe3eibtQnFqZOf8JqP8gniVx75H9HFqCcNR6mLJUzlMX4lV1Vqfz7T_asXqKhE_GQyjDffsM8rApcLAoDUAaIFeC96nkTIzSWjxIUFgQf06LVzPZEl_ZSUgLUGUfLTdJEs1onjKPM1FqJC3WJbo3jepe-FC7HFjC7Tg-1MDrbK8vuGf9BNXgeAQDo8=&vjs=3&p=5&sk=&fvj=0
0,Retail Data Analyst,The Plant Stand of Arizona,None,"All Retail Data Analysts are eligible for vacation, 401k, paid holidays and annual performance reviews. The ideal candidate for our Retail Data Analyst position...",http://www.indeed.com/pagead/clk?mo=r&ad=-6NYlbfkN0C5zhD2ezxMYx4EHJ6VNOLZqn_jAJx9HOTaRpCycMK74MlT_R45Omn7bMgaNUbxqmbXPFtGMqAjgO8jbRJiDtr31EBElEFl5yWiA1TKF44PlANTrkaJAPyL4zBIDRb8-eiqZeSp93pTQIKzbSe0CwE7yWvqQMDSK-YQPXAVIEAAaHyB2M-o434-p6_tZeDT5nu0WGPfz_IX5-26TiXw0c_YsfYg04gbnPIwvhijTgNxMJRQ9x82yN9BDaZ7Uxkui7_3KNIBoJ0BJ76Vp8owALsF_4qX6RIDubBJ3yrygDKYK3OBrQ43ZKHjzUiLk36qw5CRkltky95ttv2Vlwv3Wbp9H9w4rFWVjt-pHmZjCaeQt5TKphpx0ToiK3GtUvVhcy2uxuwxrfbF8i8WEKFKtms3pHNyVLvzlnPTQKfESD8WA2GPzGqyOU3e&vjs=3&p=1&sk=&fvj=1
1,Data Analyst,Cancer Treatment Centers of America,None,"Therefore, the Data Analyst must ensure the validity and reliability of data within the various Information Services (IS) systems....",http://www.indeed.com/pagead/clk?mo=r&ad=-6NYlbfkN0CgOeAhmEzScNAtH9dtdAR_6UkBk9qoOMCFvCQXyiq-xM9taCvEevKfYgBiM4GQQ7B5BvhQI5EGTj_15n5xctXMNiET0jItq9PSyGrBavzbu-57RHifGpRb4CbhT1qIWWo9EPPOzdD8I-8xLNe_iFDdsI3LCx8cj-rIax3aIbcr8xese3qI7WHjmDgEQqG4ETV5ZRQooakaTFDbiyiKc6pPpi8TyHd7L2v7i7j53ym5RwRrIFJ0qe8zDMd_Qrqs8N2Pyk5CuYF93GWx9iYXvY47yFd5E0pXhaUdbSbqc3fd3B0eKiSEAEWk2zl5Jslohx6jIiSGxhA0Prj8cYoNYAtQQ7qLpbBC3TZWKXDtiXywrwcEkTRT9Z4H5rEimJvmbXNG3zHrpQQYACpswxz82WdnRN_ahsHGnXPOD5rvUInsOJY_uzub_864p6WoItkl-qtHXmI16ikjGDPl2jIxlXScd8lRZhPL4BY=&vjs=3&p=2&sk=&fvj=0
2,User Experience Research Analyst,Paypal,None,"Strong data analytical skills. The User Experience Research Analyst will be a subject matter expert on collecting, analyzing and presenting data gathered from...",http://www.indeed.com/pagead/clk?mo=r&ad=-6NYlbfkN0Dn2BJrTT_MS3KLsmM1n0D6dEWYv-qvNCIwtrt37CnWGCJohfXzqRmpuDizmlYPDzcc_MhhkFDs8jpJUw3NHlsuWkc123spjBGohzoZxynWkdJwTGpJnu6zB__j5iOtm7nXS2QW_c19rfeslV9cK27-DcEQI8mcVRs8-i4jCWFqFfzsMErpBInPGQK7-2-LtKTykhoZo8jZGX0NshD2Tl9vKJtRlrCaYSV59JQW14FwwTjG6KiUGMZx-0GrPD-G8mhNcrs271Wy0ShYi99oudjOGeoTYfdTxGbwtbC3ZFYgt1Se_LKYZm4C22BHOYe__do1y1S2Ny84PS7NHHsY4fd14LahQ5eU_ucPC2mx10EtY48cOs9h7K2fd6YnJlz2-9B0rBXsi8P68mF4sA0SCINhtKcRrRju_xZbqym3IqoRvi8jLkIZ83a2al4AqFPy3Zt1VjjDUgRRH9A2E-RgjXpgV8dTfo2w2sRTzXMCjnCYKmw5t3UrwheiyZ81b7FvJOz_bOWJvTz1asw6A92Y2V-A9MDMGOrVjV4RRCryiK7D6jfkRUGKwWBU927ZqWTAbUTrHNckllKSirq_d5xfOYW3x12Bw1ZNVjTo_OLE6YN4FcnbbDIytlBvd9DYj2GnV8ZhxSRFjWS4iCZ0f0hO4rVBuW5M_43YVeS-NmHAcJltfJPwap_lk7XZgid0HKiRyfPRj3L7QipNxfJI4EfVXBMZ_IFC9y-40tmtGD4nzxl-NZTvnghjK6vEOXR7W5eJUe93vDbch6q9-quQ9v2jvtfrNH3i-G1pTypah_7QWUSNNuXRIGoXV7oSzYCxptFs2Tv2MZzLvUiZLoZHyRSFIhkfcXigMBvHDvPbi3bJYSEZXo6pZUA_0THuq1rAv4WLhCnxMhh3-2rdCsMWMt2AKHWjXOMvetpDQ_g-5ZqcExoywNSCIM_9Vk-k5nJN0GTW-w89S8PGo36AnhME-AYVFwcxoTd4EuHlxdencvPDowL001qzRoNpsRajOitQ8t9JZ4x-Ws6hjgIlwAtZsRlBUzZn&vjs=3&p=3&sk=&fvj=0
3,Financial Analyst,"Insight Enterprises, Inc.",None,"As a Financial Analyst at Insight you’ll join a team of experienced financial reporting analysts, and forecasting experts....",http://www.indeed.com/pagead/clk?mo=r&ad=-6NYlbfkN0BNxlz8woFJWlVkENbSeo0DOdnBLaExJqT7M78x2UZLriZAYknZqvaVOfpqa4jzy33U8MpiA6LcysHckh0bHQpE3z8wHhIl0fHsSMBwsTFg_1AoYhPSPfR3pUrn-j8iKlRhIeVb02BmH20uX_7VJVRE3MoTQqGXEELj7ihpEMV_qZq0Wp1au8Np_6MS1SdP1ADNiT6vVZdIz3OTpNV7A4w_9bqmYdfsI5M6J8PiAkInRLIaiAp23YbzKDenmg0MQdcI9X7L2Q0ZsIU4j2uZGclVJcuoV5wWIZ_SfLbepMGoKTQD5ouBIz4E_eWkTjqnza_WXQTUuND-dyjP0zlS3Iea7TT2910dvK4GlhHpeVUMXVIaq4BRRhLvDsSXcX0ombsnGGzT8dDPQ3Pm3ziZE9v5OxKynkAJhIsN1i-FyVsDuorjhQtSbTDUGAdlBq1p3AE=&vjs=3&p=4&sk=&fvj=1
4,Data Analyst,Concept Technology,"Phoenix, AZ","Our rapidly growing staffing company is actively looking for candidates who are skilled in Quality Analyst,Business Analyst,Data Analyst ,System Analyst &Java...",http://www.indeed.com/company/Concept-Technology/jobs/Data-Analyst-5c5063354e321d7a?fccid=f67f16d4706e99a4&vjs=3
5,Business Analyst,Concept Technology,"Phoenix, AZ","Our rapidly growing staffing company is actively looking for candidates who are skilled in Quality Analyst,Business Analyst,Data Analyst ,System Analyst &Java...",http://www.indeed.com/company/Concept-Technology/jobs/Business-Analyst-957c71bd13eb81f4?fccid=f67f16d4706e99a4&vjs=3
6,Data Analyst,"ettain Group, Inc","Phoenix, AZ","Data Analyst Job Summary*:. Metadata, Data Quality, Data Management, Business Analyst, Excel. Building Data Dictionaries:....","http://www.indeed.com/company/ettain-Group,-Inc/jobs/Data-Analyst-bfe4d98d85ce0a98?fccid=6a242008599e722f&vjs=3"
7,Business Intelligence Analyst,Arizona State University,"Tempe, AZ","Carey School of Business has an incredible opportunity for a Business Intelligence Analyst to use their analysis of education, market, and student trends, in...",http://www.indeed.com/rc/clk?jk=30a0a228dfd98dae&fccid=b97aa9a98af93bad&vjs=3
8,Junior Data Analyst,AppZen,"Chandler, AZ 85226",Passionate about data and want to ensure the best customer experience? This position’s primary focus is analyzing customers data and working with our....,http://www.indeed.com/rc/clk?jk=aa8a61816801fd87&fccid=232d2677a5ec1087&vjs=3
9,Retail Data Analyst,The Plant Stand of Arizona,"Phoenix, AZ 85042 (South Mountain area)","All Retail Data Analysts are eligible for vacation, 401k, paid holidays and annual performance reviews. The ideal candidate for our Retail Data Analyst position...",http://www.indeed.com/company/The-Plant-Stand-of-Arizona/jobs/Retail-Data-Analyst-e1350853c175f616?fccid=a2fdf9a9ec7517f1&vjs=3
10,Data Analyst,Ace Technologies,"Phoenix, AZ","Senior Data Analyst. 6+ years of Data Analyst. Data Analyst, SQL, PL/SQL, Reporting, Tableau. Phoenix, AZ (MUST BE LOCAL or able to go for an Onsite interview)....",http://www.indeed.com/rc/clk?jk=4d14168002d5c642&fccid=b7287cc45de81a80&vjs=3
11,Data Analyst I,"Insight Enterprises, Inc.","Tempe, AZ 85283","Data includes images, technical specifications and other data elements. Submit claims for data issues. Ensure automated data feeds successfully populate...",http://www.indeed.com/rc/clk?jk=96c905f103629d2f&fccid=3f1f78890d39a15e&vjs=3
12,Data Intelligence Analyst,Manifest,"Scottsdale, AZ 85251 (South Scottsdale area)","Manifest is looking to hire a Data Intelligence Analyst, with an emphasis on marketing, in our Phoenix or our NYC Studio....",http://www.indeed.com/rc/clk?jk=cfab976a9341e2a9&fccid=c832a1f118023428&vjs=3
13,Data Analyst Intern,Intel,"Phoenix, AZ 85018 (Camelback East area)",Perform data mining on both structured and unstructured data. You will be a member of a team which specializes in data science and operational excellence....,http://www.indeed.com/rc/clk?jk=2b6a6ca5732270ab&fccid=f1374be6a45f4b8a&vjs=3
14,Billing Analyst,CBRE | FacilitySource,None,"3 years (Preferred). Attention to detail and accuracy focused. This position offers a flexible work schedule in a fast paced, team-oriented environment with a...",http://www.indeed.com/pagead/clk?mo=r&ad=-6NYlbfkN0C_b9V1Oc8iIK71Hn6EoWl1qL12MzA91_MwuoN-hYCyUAm9pE2BxsvT_6te6lqsCLsmY9kD2iEF0FJ-Hh1Nc4OI3KFMt8XhCA3FGH3tK0nzl-y_ZCMx0a_j4skvXyZIhOG6PhNFuV2Ph9cvgt11VZHfraX4LlYQUFO46mYZVpvy5aTFj5woX1_StEfb6FEFAe8RBc9PVq5jli0kYizvM8SS8vIEuc9hx0GCsIh4hsLWoXqQz8UIcyTnuTeMYGfFGd6Hoj9TECxkYu3pIbfSYplGZWAUfrbUYakuZ_16OinHw_ccwkC3RYlQQlFbI2UqvCXMUuAGudv5uxXz1jSo0owmUFGxwmRDssO_eeaCRej7831vi463aKUcmr05QIULAgqcETyRHYsllXQQZvpatkM-Ns8eYT4lQhYWyaF9NLa7eg==&vjs=3&p=5&sk=&fvj=1
15,Data Analytics Associate,First Help Financial,None,Experience in analyzing large and complex data sets. You will see the challenges and opportunities of building a company through technology and data and use...,http://www.indeed.com/pagead/clk?mo=r&ad=-6NYlbfkN0Dl5fZaZjrag2gWfgYaO97yVWt_ZSEP44bpS_FstDyyEthTO4pBqv5pgTEsuY-1mcJme8a3SykJdumAXLza4n0yF1ZtAurNNA_xdZCCl2lbCEfDD-5QHki15k-3IBomT5HDZxS17eOBUCfZFW2VuFUEJfby1GJi7eqboIYJSVqUhHR2i60a915BkbjQ2dHqtZaFYpXGpktKthWpKHyN8JrkRKw6JgyU6e5VfEVHOPpBkNCSb__L_343RzF-7U8SEya8AZrbUifGmccUA0gBBVjls-FGrlPV2gioHLrND0Dh5HS14tZGm0kTZLwboPmuD-X9Y5hcN-J-I0BOBYY9wq7m0uOYU9vJfvy69o1U0kxVHiPX-H5KIVjgB-l4aiBxZIh38XdBix5-QQII-1mouX2Ygn6zLdHQRIps4ZNVa2jNe0grVGeQVBGF&vjs=3&p=6&sk=&fvj=1
0,Transportation Analyst,Ryder,None,Transportation Analyst- Full Time. Strong Excel & Data Analysis Exp. Execute analysis and data preparation in support of sales activities....,http://www.indeed.com/pagead/clk?mo=r&ad=-6NYlbfkN0D31HecsZnCCw9qqvpsD9_vh33AQqJiqawrUhKlWEySOfwv7txuGgonNGTUNLCm3mp4ahluoNcVIEZwZOtrEgr2vm0iSxcTyyQL5JcRPpdEvb6DDNi8eVbt96uOXYIKAmn4oOjA8V8hTWjceIRB53uJonb7RbeNXRT8SNYGlqjgQ9UmV3aa3DfmUy8fbceDEmJIyNVvMPmLmv-1pgPye0zt9CpJ2hmli4BrSeN5f7YcxMJUWMRB1jMGnZCA0Wg4fFQQYTeUEB5JNnJpBxY3npRD-nbGvIBDtP5dnSqJpesyx7M4Gi9aKAf8npAXElhejpGK19jW01Ans0WV82IhWiBN6ICDAK_APdShvngAfPBtAw-FMmrMgQEin8VGHOzp4Yt-kp9fAaaHam19j5hWlPS9OBXgonuScbsrftuiCmdB_faFMBrxnnLU2mfVdS5zSQfCQDWHdRWmNGUX-UqZTlD7_-ghTQ4eNJJ2Lx7Ol3xrgZV5iTJKTrpgFLB_PCWUm_2KAN9BfhCYIZYG01Eu9-fYz3Oai6NDF8I4etc1wETUXYPvE_YpkBqMayh5PgcQCH2m3ZzE1ByZS55YlJxZlFHf&vjs=3&p=1&sk=&fvj=0
1,Open Interviews - Data Mapping & Validation Analyst- Loan Tr...,Shellpoint Mortgage Servicing,None,Data Mapping & Validation Analyst- Loan Transfers. Shellpoint Mortgage Servicing Winter Hiring Event!...,http://www.indeed.com/pagead/clk?mo=r&ad=-6NYlbfkN0Btxs39KmTzjw_u_hUXcyTcLpNeUj18C2Nw5A7DCW0FWBr0kUmbIj9lTpO2r1ziIeyHy4mrxFvoKkL2fTZifTCYOnW2fMfBI7TZDcncmPePWL-DawlRtMuV_FD-tWbsMovz4BVQjKBGv9av_12rX3pl0exB80mG6eXZMcqeIq1XeJbcMIjSiyGmqDxYlG0HZ1I_vu3LBBEZf_nlaC60LeEtu123Hw2p0i2JaSajx71wvMjrIK3G7IOtgToBi5_3f-VA9vDAR3daEk-bB3TCS1orM-QP8lwgptwAv2d3CexMZoacm9v8qYGtaFbId75geJeL4-oZpXAhAsKEtiyDk9CLxzrbWJ-fkRGoCtfqihJD6_2KLcjRHxlC22JIGq7nShQMgGrfza2QsYoe2HmyrWHO0ieZei_3wvfPqrlNc9YNjDpRL345mVjn&vjs=3&p=2&sk=&fvj=0
2,Open Interviews - Analyst II,Shellpoint Mortgage Servicing,None,Data Mapping & Validation Analyst- Loan Transfers. Shellpoint Mortgage Servicing Winter Hiring Event!...,http://www.indeed.com/pagead/clk?mo=r&ad=-6NYlbfkN0Btxs39KmTzjw_u_hUXcyTcLpNeUj18C2Nw5A7DCW0FWBr0kUmbIj9lTpO2r1ziIeyHy4mrxFvoKqiWULs5hyz4IFYuKqLAVD3pfkjCb318N80cYnb2TMabF2xX6KZATiYvSJ1iX-LBjowl3Vi293Phf9uuM9urs1T_T8YCkftMgGqNeor9P_8qt75eb_j-2wARVJTqODIuxUkf1rmHad3UMovg3ONmrQDJj-S745_OdZr1h04wwwo_Wjty1CDcC1H3pNIAtWNJAD6fEAwn_sy47qqNcPOqd6A1fLs6Xhm6bj1dzzv-tHM0fMzuBIahwmJ3jYJg1emfUTFX9H_Xm0wPi6nDPaVpmnXC3Bw9m2HpKdYg77vElbd4k0WIQspkkWHdPiqZZIpumMw2cXvLWJuX7KzpkmZFuqkh5LhThQeNx0EGto6VXlj_&vjs=3&p=3&sk=&fvj=0
3,Healthcare Data Analyst,"Red Horizon, LLC","Houston, TX 77003 (East End area)","Analyze payment data and assist with billing and collections in an employee friendly environment. $40,000.00 to $60,000.00 /year....",http://www.indeed.com/company/ISPINE/jobs/Healthcare-Data-Analyst-68bd9e4a829113d6?fccid=4e422c682c713b53&vjs=3
4,Data Analyst,"Two Sigma Investments, LLC.","Houston, TX","Help drive continuous improvements to data quality procedures and a consistent approach to how data quality is measured, monitored and reported;...",http://www.indeed.com/rc/clk?jk=377fa5a966597fde&fccid=facc18fe475dac15&vjs=3
5,Data Analyst,Rice University,"Houston, TX 77017 (Pasadena area)","Job Title Data Analyst. Under minimal supervision, the Data Analyst collects, analyzes, and interprets various types of data, using varied types of data sets...",http://www.indeed.com/rc/clk?jk=f927e7a3fb3eac99&fccid=a3d79a6d43cd3473&vjs=3
