,Title,Company,Location,Description,URLs
1,Front-End Web Developer / Designer,TouchSource,None,Rapidly growing digital signage company based in Boulder County is hiring a full-time Front-End Designer/Developer to work ON-SITE. Must have extensive...,http://www.indeed.com/pagead/clk?mo=r&ad=-6NYlbfkN0CmrEXGFz7WinEjKHGeo7bPwr0RLt9dFA0QFMKt_EMIpjs_v9aAYt4GK4JZSM0yQqa79ccbB3JptLrzPEmhr_hislcJ9LnawnozT8Se6yN72-9kP_bud57o4LdDU-G7zTD348_jq5jCpVYvgqWoMZE759xQnCBYHqoPmRukVaYUpwBxaCye8WjNx69NW1WoRQf1WTblkcc1GmDzTGXTtRq9LczkiisKipFcG73Mn6l7e4Dr-4pugW_q0qg8XU0pGIi0MB3CNaULSnA8oAwto9TyjjSXvGEndhNMWU9e2TGvB78QosAMeuB38VXR-qB4BGPSpcpzWCJNlc4q5XVyTOFMcuHgMjviBeR5hi7Nx0D6A8oPm54zG3eprEEMMLtyvCj6qiv9dVA2RuOv32_MsPWxsUF-SnOKV4QFEuAprB2v6RbqO6eIe7Rt9rA7MjxQqEs=&vjs=3&p=2&sk=&fvj=1
2,Lead Front End Developer,PlaceWise Digital,None,Do you love creating front end styles and building cutting edge websites? The right person will have a track record of demonstrating true front end production...,http://www.indeed.com/pagead/clk?mo=r&ad=-6NYlbfkN0A6g4auqxlXb0os8Xc9NqATMHxUxxmoE5XFAbV3B8GLQ3IZdPlGOnrtPLxBiqIsDbT24e6s_9i_vaQbIHGnwQMRahqbTH4MYttDHW2x_P5NIJoXdT00km5TGBwNgHuBz9vjmqjUvcu0DbaFXf2fj0Nzrnx2i1Mb9tXeJIFlEOTWmCsLs0V0VOFVcOCXoG-FEFkP7FnXj1ufZS-ItqlpSwFolP9vOHBzY-mdWMGbKIErfeKJ9wjLsMWz049MrfRbCAWULQGlSQmC86EMLv7I74u9WwOV63U9lg8xmM_cjCXufoIU6Y1155feKkSsjSJt-_gZLDu0Mvh-a52T_JD1gnQsJ-TlSYKzcUO1kPnqpHNcdG_KFkWeZAPqE6Bzwuo8rnc0RD2Wnvg1mFa5oU9h9IxewScSLyTSRE1wExaHg0ntC-wMfugZZIeI5mgN0H74kXTtziOpU12bwg==&vjs=3&p=3&sk=&fvj=1
3,Application Developer,"Tribal, LLC.",None,Excellent at leading and developing a team of developers from dispersed locations. We are looking for a developer with a passion for building SaaS products and...,http://www.indeed.com/pagead/clk?mo=r&ad=-6NYlbfkN0AbJe2WnFKM404Hwtjf33L6hG1bLR1Ei8Dd3xv_WaGEXe3HnPo1egrLxEMURgCRa4VbeksrAQEjF0PULH3DCWWooRZarusW5qfjCHp2-tclJeiLto1lNX3NmxaD1uSsZ6izwwxyOv4vakuCq18HjMdYaCd9kMZ77cBwndioG10Vv5NKOxlWmC1RoTViIXISyvdrfku6HQWtS3acsxriT0CD6VFGJClgtZbFBsbE8vu6Rc6QtRtW7OSXEkYYjZON4ProUMbNgCcwUH2h7pWSwaub4IiggOsF2Nl09slqej1bZv24OKtjaomfXhn_cF0-Y5QFdj_1451DM9vGGbZELMrk0INkpdpIvBgcPnxq540EGBcgXcxqlvOlrlzUnyynvZy8UuzNaDVn5qaqg-ShZW_MG63ZDTb0xT9l8QfSjvmvLCIhy3e6c5azUr4YT7CtsfU=&vjs=3&p=4&sk=&fvj=1
4,Software Developer II,SmartEtailing,None,Participate in code reviews for other developers on the team. Did you hear?...,http://www.indeed.com/pagead/clk?mo=r&ad=-6NYlbfkN0DLqQ8dlGrqv7i5urtYT82Ro_Ksb90QUdpVUTnCpQmBqQmdkgbTxUARpkFQvJwEIWiSwq6qB8YJ4NKQH7kauPsUe70VbR6omwofIKFA0FyZgjrCr6lG02hZhMxSrRTr_zGyNyJimRfHXxNMvQZ6sR40T5ZAbVN9owbLa3j4cYQsYyvasN1I-_SjJYMMaiX5xmy3deg6HIka8ALbCzzq0dJHMSypl0Dc5lDbFAshavxUKU9UZGMTduWOOyhmkmvri77NdFDiHZBpTF7aZyY6tSoZ9_InF4o3OTpnWj1kpcS5YbQh3twxJcH5FMjBqCMJ3_ZyG-Z1239zDkR3T6_8ZlVYo91rMQYpvu6baF-JvPcIXGUEZYOcXwlB9MXBF8GNzBd7TuWnR0X6a87BVaYvMkMt-7r7uHd07fNl3iMJSZYhQfvcwQDN5HB4e1RiAMI5ycM=&vjs=3&p=5&sk=&fvj=1
5,Front End Developer,Pierry Software Inc,"Boulder, CO 80301","Pierry is a digital marketing agency seeking a Front End Developer to join our Creative/Development (CDEV) team in Louisville, CO....",http://www.indeed.com/rc/clk?jk=777c820bcc5ee460&fccid=36e43c2affa095ef&vjs=3
6,Front-End Web Developer / Designer,zavvie,"Boulder, CO",Join our growing team! zavvie is a funded web startup looking for exceptionally talented and driven individuals. We are on the cutting edge of the hottest...,http://www.indeed.com/company/zavvie/jobs/Front-End-Web-Developer-485dba432665077a?fccid=dae7c16399a3d69a&vjs=3
7,Product Content Developer,Creative Alignments,"Boulder, CO","Who We Are: Simple Energy is a fast-paced, fast-growing, Boulder-based startup. We graduated TechStars in 2011 and have continued growing and improving since...",http://www.indeed.com/rc/clk?jk=0c4ee71ca1f6522c&fccid=8936b6989ae469b4&vjs=3
8,Front-End Engineer,Creative Alignments,"Boulder, CO","Who We Are: Simple Energy is a fast-paced, fast-growing, Boulder-based startup. We graduated TechStars in 2011 and have continued growing and improving since...",http://www.indeed.com/rc/clk?jk=79eee024ee11d2fe&fccid=8936b6989ae469b4&vjs=3
9,Front End Web Developer,Foundation Learning,"Lakewood, CO",We’re looking for a Front-End Web Developer who will take an active role on our team. Our developer must have back-end knowledge as well as working with front...,http://www.indeed.com/company/Foundation-Learning/jobs/Front-End-Web-Developer-fcf84922a31b2550?fccid=1c460b9edae522d7&vjs=3
10,Data-Oriented Front-End Developer,Talus Analytics,"Boulder, CO","Talus Analytics *is hiring a front-end developer with demonstrated experience building web front-ends in JavaScript, HTML, and CSS on top of complex data...",http://www.indeed.com/company/Talus-Analytics/jobs/Data-Oriented-Front-End-Developer-9e6b0efd6b85f7de?fccid=0c48e169a705444b&vjs=3
11,Front-End Developer,Trimble Inc.,"Boulder, CO","As a Front-End Developer you’ll join a small team of marketers, creative strategists, content developers, and designers working across several sites, product...",http://www.indeed.com/rc/clk?jk=279eb046ba71ab3d&fccid=3d2456270cbb298b&vjs=3
12,Front-End Developer,The Motley Fool,"Lakewood, CO",Front-End Developer Is your happy place making web pages look amazing? Fine-tuning CSS to look its best on every device and browser? Exploring the latest...,http://www.indeed.com/rc/clk?jk=41758e7d52f875f2&fccid=62d0bf8f2d130eaa&vjs=3
13,Front End Developer,InterSources Inc,"Denver, CO",Front End Developer. Front end development:. Experienced building front end single page application consuming REST APIs....,http://www.indeed.com/company/InterSources-Inc/jobs/Front-End-Developer-a42b259eac275e29?fccid=08dfa873b56badaf&vjs=3
14,Front-End Web Developer / Designer,TouchSource,"Lafayette, CO",Rapidly growing digital signage company based in Boulder County is hiring a full-time Front-End Designer/Developer to work ON-SITE. Must have extensive...,http://www.indeed.com/company/TouchSource/jobs/Front-End-Web-Developer-0c9a424f03658abb?fccid=23eb37baaa54539c&vjs=3
15,Front End Developer,Starlight Software,None,Minimum of 4 years professional experience as a Software Engineer or Developer. We are looking for a talented and driven frontend developer with 3+ years of...,http://www.indeed.com/pagead/clk?mo=r&ad=-6NYlbfkN0CcI8jPK-Bcbx_9hPy_Hj3KgZ_phD7ZcoRv65LCYV-Vwv8dOG7girqW0VgbOHWRzOaZX9w017dFIrCzuv5rLHTwLK9Ww_jRxLiLKlQJQ2uZXUukOKiwgBSj3B_oLbWnTXC-8N4ZBxQB6A45D0Js0aHui4Yh8nZ4gSEAA0DHKU4a8d5L5URXoML1eOfAErBoSIKIFGZR9ADPB_SIBtDNgiEOrvRVeP-Elvw5AAIOUiW6UijzNlyAE0SHZZU8ku_qBVzDAUoUK2evyvIUyGyOO0HRz9cTJRVKi3JVE0ujDjmDku7c1KWQ_4GWC74fQL0KE0b2H-92-zT9-68dKGio0tugtTpfykyuV7w6kgVmDwqGdVbivMLlnPd41G-__qN4JQUTBHO0rWvj9QczEx8hkil_12BGlY12B-Dw7PHw2hHYbTFhnm7Qk2Dz5-G2WbiRocc=&vjs=3&p=6&sk=&fvj=1
16,Mobile Developer,Outside Analytics,None,"Who We Are At Outside Analytics we are passionate about the outdoors and building software that increases outdoor accessibility, usage, and understanding....",http://www.indeed.com/pagead/clk?mo=r&ad=-6NYlbfkN0BEGGgm7J6bu3v2RMVZVaARTecuIZSJsUT5GDbjXN8SEqqAzrhywqNzoeRISqBrmFmTQnegiNXhjfnBiX4rfHja5aAknEXVVg-EvnV3j9F8j73_rkEwYlZ4_7aSBBUxQt7Bp_Q7TURRomJWAda5SZJ1ic1mdqOseJs9NZ50QtVq_AGljRf3FvaIqj7g5rTvUilGK1VMi0fv3BakcFr0wfNM6I37h6jvaza8HxgR7AQtZ7hqmgO-oI1UIZfB8oUFbMojuOji7-3qs9Q-H5P5ko1PL57gZiqhsrKSP0D43OBWQ9_1UaAVCoatUmyQfB95HbR5Pq_0lNInM-cJNXQYMecZ3HbX1O_dQOaKC-Xr_c3yc5KJ5Q48I5JtogjQzVnRGCEzaSAZ39ZOwYPL_Pv4MHPbrkp7jNZAKnmTARPvunXI5xVUkw9sJrgcvFhgf9Fwa5Q=&vjs=3&p=7&sk=&fvj=1
0,Front End Web Developer/Designer,Big Marlin Group,None,"Collaborate *with developers, designers, system administrators, and customers. A Web Developer must have experience in the planning and the delivery of websites...",http://www.indeed.com/pagead/clk?mo=r&ad=-6NYlbfkN0C18ijm3Zo8KBewd1Dn1qoEnXddEK8s9OC4vNkKCpIjHUxN9vku_oHyBXQK8AqSUscCJWWGLhRtezq0XyeMbReIHDznSwWrpVb0mI_X3DAmL0ytvxxRKf0oVfPkNT7Cs39J1CSOd8LQdaU2ocVLHF2UL5P2dtXtyF5JzVlEp7y1iLWxolOFjwHOCkXjNnbj7fAwfg018ycsrQW6IKiolDms6FclhKGP5eJWr98j6fRIVrl2qLrz8TKSXnv3SiW22miu_mditMIzjXW5Y1kGa7LhuYbeqCMlT54OfBO-aui5YIW9lNSP5yI5jou_AwZKK-3jfMTa02FeiNgo572GSCVeGRClqmmn5V228yqnBvEiMS2vrhnpP7qOLayrzv8Ccz22w3Z-MNgMh9aJHTVj7DKceyWQGeAf0AGhU5e4gVvGzOzg14q6N7mVcsUfD8be8HZxDBvlkzDNcA==&vjs=3&p=1&sk=&fvj=1
1,Front End Software Developer,GymnasticBodies,None,"We are currently hiring for a Front End Software Developer to join our team. The Front End Software Developer is a full time, salaried position that will be...",http://www.indeed.com/pagead/clk?mo=r&ad=-6NYlbfkN0DZw1VbJQk92z1_Q4QZuK59dSNoS5LsQOkTx9uODJz2I3ZpQD_JvapRXkqwXQljA6Gq3N7LNI6uiPoS2JnHWreOPNFqxVhxULgJrWAXoYwwIL9M4oX7FW8nVVTZpUiiMoqVCyscDYw_0c69LWvA4uR0dJLjC1Vl-VCWZCvQCNCKSrAPTqWisKWhOEDkThWXWi1rg8_eNDK9xUoOcqYHjPe770CxMYMAX4Ua7j82roCo3J0SomsNRoCMm4GLwC0L767b6DuQiqYMocduQRSLX26G_i7L7MK70y4S6pXp9lGCoD8RbBXdm4KXG2EC7zixsCN-5UT6LadpSKsZEIQnLqUIQjEe4ZVnJPWe7GBN-nlLtSqmkRtDD8dD-inlGbgsU9CWvRQm_uA_gQmhNZC3JnT_Z6HKm2_wbFxeVeb2_uZ784bVeMogWHXpdOOoK_7sjeAryPemiR05Fg==&vjs=3&p=2&sk=&fvj=1
2,Front-End Developer,Grand Canyon Education,None,"Proficiency with front end task runners and build tools such as NPM, Grunt, Gulp, and/or Webpack. Grand Canyon Education is seeking a Front-End Developer....",http://www.indeed.com/pagead/clk?mo=r&ad=-6NYlbfkN0BiobpwoNy_B-oX-HUfDoWELXOXlQQO18wPxNOgReLJ3jAbkcZHOWcpiocFrEF7dl8aRNG87WmJMHSl4DQlN67M36SORKPOABpmJbkDfK7y3Arlzz8v3si361nZ_dLbbTMWNOlXK-wQZcUQscw_INis20IE-z_kC_DoqdQzzYDkM_j1Yzson4xBXonnTiIu3B-hD79o25gzLt_Smcxc0MIQwcyby-JPH5uq2ilAnzq5FR5GK7-vCz8pbYAgyZ86P-86U79619XWoiJMJ9GU0IVBxIVNQVnI0hufmrOg0R_mdnILa5enNaERMx5ZXXv0H7gHjLI_kKP5TJ7PDbAgoqrpWulUrqbHSjdkA6Lec9LeCqnqErc6ODVaGpUR22uLtooSundPl4S9D7hXSmbLSl1z4KyJtfnohq9ckijcNi4f4ALdttuwmr9A8p7zyY4yxrREV_idGQOjrB9mEhWqEfTXQY7Wbs0pR_UFJVxZtGA0L5Jj8vNwLKKJlyqvfqMO4ez0zySydpkIMt3a7iF2bJweOXVOJPlRDjI=&vjs=3&p=3&sk=&fvj=0
3,Full Stack Web Developer,To Be Disclosed,None,We are looking for a professional full stack web developer. We need someone who is capable of building plugins from the ground up and work with other developers...,http://www.indeed.com/pagead/clk?mo=r&ad=-6NYlbfkN0CFm3GVKmNQ0Sz8Z4QKzobi_RpKJ1ywKBrFm1qi58O_fnEW-LAi7LnR8V6R2MiDS4KxoMYrakTAHVtA9utIRCj5e0fnGpu2zVXXIW9v_nWKju_mZTio0FZOOOv1FwIANL85D2K-9XxYnDoZ91_05pS7_TwluNB13_SG0aYrIjpx8VE-v42a45T3iP-XVvWJVC2nDXAMHs5NxQOMwjYMTfHLF0Xv23mb05Rizayv-Grhf5WySOm6RUsvA2LxYzLTHMcsIA0i7qnC2MNDMz1eSXCqgKWKTGH0aCgqcceOQ7p2vUmTio-v1eEAun3P8uxkMZQClHG_vbw4XuMJdzlaUHGQ8sZ4qDnaiXIPxh97QiHwIUwRrwnTM6u1B-uJiNGnGnCrqW_CUXK6f5li7TcMWlI42ePyZ-EiqKoYDBCTjEXC88VkO8uEjm-Wv1LcOAYZyJ8=&vjs=3&p=4&sk=&fvj=1
4,UI Developer,Pegasus Solutions,None,"Able to work with core front end and middleware technologies, including HTML5, JavaScript, jQuery, Play, AngularJS and UI MVC frameworks....",http://www.indeed.com/pagead/clk?mo=r&ad=-6NYlbfkN0BPpuFIGcCgXBr2cN6ln_T5QNvI1LNZbIvRfW8gpI8txF3PpvOQl4wnHvRXidvrOectuuEo5oTmDeOOTAxV5LYH2Aa58JzFHFsM2U0tp2MyTe8TKoSwWxKbsrAOfcbyEcM4KBRA5iidD1bGV4NYIeaVUC_puZYpZEM5K19wzkiQNfmZoLzJGQNzdL4q9wEQS4NhMfM7bv9B6IpomprOR1ZyXredGRG4l8hcneVZHkqVbYJTniYzCfmN3ieJSIXOQTZawXLJasWYAFFUTnqWcu-lP4PY1aAlxucYBTC2IQ97khzoPIOo4o-Goq-fEYe_T2jsSrC8VkzqcgmUuf1iGQ5QihztumBBgOFoZRHPTtUs0AqSeIII_VeHh9_C90SwHFFJpvSs9WQPdjpoiqvGEY2qV6t6V0BuXwdX-yeLaHSWwgs2zv8swjDFbFmYZCLXI44=&vjs=3&p=5&sk=&fvj=1
5,Front End Software Developer,GymnasticBodies,"Phoenix, AZ","We are currently hiring for a Front End Software Developer to join our team. The Front End Software Developer is a full time, salaried position that will be...",http://www.indeed.com/company/GymnasticBodies/jobs/Front-End-Software-Developer-b1c9d67e6c1fdef0?fccid=d514c5f1b7cbcae5&vjs=3
6,Front-End Web Developer,Avintiv Media,"Scottsdale, AZ",Front end development:. Our individual services that we offer are simply aspects that contribute to their end goals....,http://www.indeed.com/company/Avintiv-Media/jobs/Front-End-Web-Developer-bc271595ead2f165?fccid=4306569f189fd908&vjs=3
7,Front-End Developer,Grand Canyon Education,"Phoenix, AZ","Proficiency with front end task runners and build tools such as NPM, Grunt, Gulp, and/or Webpack. Grand Canyon Education is seeking a Front-End Developer....",http://www.indeed.com/rc/clk?jk=1602633439bcb429&fccid=85f1e6a323b3b597&vjs=3
8,Front End Developer (Contract),Ingenworks,"Phoenix, AZ",Front end development:. 5+ years of professional software engineering experience....,http://www.indeed.com/company/Ingenworks/jobs/Front-End-Developer-e284fbc1980599ae?fccid=a4f481a80f763e1b&vjs=3
9,Front End Developer,Avintiv Media,"Scottsdale, AZ","Our individual services that we offer are simply aspects that contribute to their end goals. The position of Web Developer requires a self-motivated, detail...",http://www.indeed.com/rc/clk?jk=9873f8497ed78fad&fccid=ab83d7704768b186&vjs=3
10,Principle Front-End Web Developer,Microchip Technology,"Chandler, AZ 85224",Principle Front-End Web Developer. Microchip Technology is searching for a Principal Front-End Web Developer....,http://www.indeed.com/rc/clk?jk=4c8314d207957272&fccid=8c38fd5503448ab2&vjs=3
11,Front End Web Developer / Designer,BizIQ,"Phoenix, AZ 85018 (Camelback East area)","We're looking for a positive, energetic, enthusiastic, experienced Front End Web Developer/Designer to join our winning Team!...",http://www.indeed.com/rc/clk?jk=7944b5d7b9c52a7a&fccid=7c56d8fb3b770ba3&vjs=3
12,Front-End Web Developer,Big Marlin Group,"Gilbert, AZ",Front-End Web Developer. We’re searching for a well-rounded developer to help build and maintain client’s websites....,http://www.indeed.com/rc/clk?jk=a5142c93afa1c7cc&fccid=f9f37ff935474089&vjs=3
13,Front-End AngularJS Developer,BizFlow Corporation,"Phoenix, AZ","Front end development:. BizFlow Corporation is seeking exceptional customer focused and results driven FRONT-END Angular 2.0 Developer, to join a growing team...",http://www.indeed.com/company/BizFlow-Corporation/jobs/Front-End-Angularj-Developer-c40f3c3c46fc85f8?fccid=690dd7997a4d6c4d&vjs=3
14,Front-End Developer >,I-ology,"Scottsdale, AZ 85260 (North Scottsdale area)",Experience working with .NET MVC web applications or back end code. The Front-End Developer at I-ology develops functional and appealing web- and mobile-based...,http://www.indeed.com/rc/clk?jk=211aa4c8f841c3f9&fccid=317825f04e52e241&vjs=3
15,Front-End Web Developer,Avintiv Media,None,Front end development:. Our individual services that we offer are simply aspects that contribute to their end goals....,http://www.indeed.com/pagead/clk?mo=r&ad=-6NYlbfkN0AjEsXaEtZNoxJ6bdS3Gw4hGwz-HSINv-I27Wg6yRibORbmkxDI9yUCALtcrYXohZMQN-UxcXkj8HG89jfdsGJL4-4Zzx-Ou0uG9n7hthuGjIirXnDx1iKNbwWQrzvNANSs-NF8f1z3oHOCkGJv8RvDkvq6TDyHSMACTclGqIYT3Loe_rcUnMMVg2R0pOmU2S48F_cl30EYDh1Zanm4cqeV9SAMrKyBtsptpraMo9K1wrK1SkgNlJ09QFpgY8UxZKJnhOJe0_krF4y62DsfdD4JIwtseUE25a3AhSisvtRM82PFtvT8S9rJuFwZ8OxodVuPYhRCzXEe1CaGeiGWOi73Tn8h3Sna4PxvRWN-nhoPhUicdU7l-8WUBwJBudL_IsGCxPd7KdShEbJ91cYWw_iXUZ-s6NXsTaFixaZGd1FmOgmtXBZ-nsxsfw8Jyd0RjSc=&vjs=3&p=6&sk=&fvj=1
16,Senior Front End Developer,KUBRA,None,"As a Senior Front End Developer, you will build large client-side web applications entirely in JavaScript....",http://www.indeed.com/pagead/clk?mo=r&ad=-6NYlbfkN0BVVjiO4Re_H6DyxaJsq5UsxDtfFg7_-bv4tG4bdz1p9oyxA_AG-JKDJwXFZxbnKl4sIcKlGhZjwp8lq1FEu_y4kGNJ2BtlfmH3oKaIr5aUGX6BTY-nA4hk_XOZ2Fzqo416f5vaeaAuU72tpOekKr1y5IH_E9LT27tjgjkWN9pYyaidj0OO6kAQXNJ5reK9yCq-uKhqPjDiLotAh8mZREs6JIIOZm_xAeHjpz5dJ6Xkbxx5GBSHaTf8k1HRryllNlml5Xcf9Pb4CA-21YEWW2fC9IFuxPHJXG-_xwyEVNwqC5CLFWrCUveXFfI9_CNmxxyomE_L-aOrPIWp3rmJuGTbfB7XF2GPR5wFZo6S5KN7gRL4pXGVv03N76d5vIpwhmjLGeoY9F0mlnzRKrkjuI9GLxNig35kG9LsmKXC_6xoCiDecSt1T--un-CDHR37kucApP99i7zXaHX34f8WwRpDv7Oi5SFhacjqI2u9rxOAvcctCMAVZ8y4H5ywxQ9YdBQKQLIe2WDl9PAGYW6n0lneIPFk5Tl5fH4nd3HGTxJrGUzN0h_IGSHjSWfGOF1w6RIMAUQWlykK0hUfet-GZYHPbTB4gTY2RYcsc__i_dLLbA==&vjs=3&p=7&sk=&fvj=0
0,Front-End Web Developer/Programmer,"Primary Arms, LLC",None,"Front-End Web Developer/ Programmer (Houston, TX)*. We are Primary Arms, and we’re looking to hire a Front-End Web Developer/Programmers for our exciting e...",http://www.indeed.com/pagead/clk?mo=r&ad=-6NYlbfkN0CPf7BvP3mETVdnHQTHHj7vKHh1HGGimUOVUMjD2QgXH8DRgpEMtM_sm-XF7j4VSjKMnZ0UA1IezTJEwvTF_X2A30JE8vJdU4cpfufk5W2OigoX5mBRAoCtBD3wiDah_8zXC-XY9-ICj7EMA68QJRJdBgDqZ0PpSTmXRZbpmA_Pn2gs_w-nBa_vzE0SKkwB7BbAYjnNgdH7Ue0EBchm38ugnR5F5ASg1O7oQ2u-clApNCdV9OQnaofLxDZ-ss9f5CfxnACW-jgUEy1ipT2DWYQtvZb3gAwuvePie3BjsvlTin_tW_QPjSBhi8yixUhCV4v1yspE4NZwMnzc0mrQmsImlc511fWeCHNSMFoLGuuYnwZVNjwDYfgwy7SgkNvb8g1GOR4Gb2z_YjlodF3r-PRSeG7atjdUzswE26mfidPOThKIy2lzrhRyS6Cg52iPvvZ9LsnNsBpCsQ==&vjs=3&p=1&sk=&fvj=1
1,Junior Web Developer,Workforce Opportunity Services,None,Workforce Opportunity Services (WOS) is launching a new opportunity to mentor and employ Young Adults in the field of Junior Web Development. This opportunity...,http://www.indeed.com/pagead/clk?mo=r&ad=-6NYlbfkN0Cg2EfBWPUJaBAt4LRBUQYdDsVwfvaJOUhcLQh7tRHeQb4CrDvMPSh-nuSuuyqGahaS9Etd_0ORQI4N7bvwXFBmF25GVlHKrRw59KqromON6d9JC6kchm015-P_6gF7tSzW1lVO533lVMoumRnVMImonUZFc4Q0no-hN0NZkYq_4JitFWHoPkXEJCDDpw7V0TdmTUYasrkVLbVqovU2SC6-E6DEj9-d1vj9JMbXodbV_hHb2aiLg0OL_-AL_kqUtd_PRdG-qTzCdroNjhDMzSYS4xJSCtEGxA_bx-s5_GGjlBWBxSECA6Kg9RJXFvF2KLGdrYpEcHf7vQk8V4OnknynVs5dak70piVwFhgMZKDllZhUNkNUaEpyBwRA0yrwC0QUQIx-8Uv0LoI2J9sGhEkP952_pRgQTdoxA1HsZxLEfBLfy-urA7m7&vjs=3&p=2&sk=&fvj=0
2,UI/UX Developer,A Houston Company,None,"As a software developer, you will be working on developing and implementing features in our front-end and environments written in Javascript/Java, React.js/...",http://www.indeed.com/pagead/clk?mo=r&ad=-6NYlbfkN0C6KSufF7PXZuanDcxz_MG-jcUVJaX-KoIoxfXyz87h6zvm3r_3baWuOWTWWpz8odtLVcgd8kqwOvUPsegB2Jw20fvLlLucQwhztXzXvN7HV0doKULfUSIpL_O2R5Jw4oTYU0DByevsI0dQkrkUz3UT0orSBjNTiPdIxbgInGlZhDaC-PXBaIF89Vf4Z3p6KolKvrYMu7cdKGhobTg3PuLl2-Ge4wnDZzeFCmm6o6mlyZ1wacDVdLV8WuG7PH9MeWp9MiCgXazKJoZ1GJ5mAjA1Y6hT_jvCt9dUZVWSmJKnoMAuAK4IhlJSO77QnvQr_T39uie72UDpVCG_G6ZjLWzGoA0cSPtQznPeby1yAMEb7mso9fTVBvpLXN5X2T9Y2YzAqiV5ycCCk0PC-xu53Xa_rM2A4guWYMnFtpZ1EvJ7TsjQ8jfzKkXo7Xmkqwb0pzH0EU-T-XiEPQ==&vjs=3&p=3&sk=&fvj=1
3,"Mobile Application Developer-$114,000/yr",s•com,None,Mobile Application Developer. Currently seeking Mobile Application Developers in the Houston area! Understand back-end system/services to access when building...,http://www.indeed.com/pagead/clk?mo=r&ad=-6NYlbfkN0CaS1gMLmTedAXYvTEVTkwRtx8aWd8K7Sj7m33HPwqMl0sVykP7FbkZNUVT4DlwFEYvMySOQKcEerJbcgIuZ1rR5GXPn-1c8KxWVhZnR0qnby5tCF9WX4Xrn6xEYX4ccstVUpKkirOzq6qdLHeQkUkHJFebASUJEvaPBJ8qZ5dnfh6iiQ2nU4a4keSY00-rk69P5VIZrO-XZb2nG-JrkIIE5YTSU7VQpUDdXnVFP7AIp97ihlYTyPRXtEd0bMoW3cy7BwTx74M63vQIXqxeMJfUTQOuCTYWCcTVBGnIADuH425iR7j4rzxWEjn-rG158_nu5XdEAr9qygTt1LeZkRqEEWufYI0jcvn2uREFV7MQHe85BhiPy2ugxQtsTi8rhSe4XfedypPGyDR9vaQCr9PB0az6oIcoumAQyF0HNYRdjlT567O_nVgaTINw0E55PP--sJM3MowVJQ==&vjs=3&p=4&sk=&fvj=0
4,Senior Frontend Engineer,Worldwide Machinery,None,"6+ years as a frontend software developer. We are looking for a talented and ambitious developer who wants to create modern, responsive, beautiful web...",http://www.indeed.com/pagead/clk?mo=r&ad=-6NYlbfkN0AfCa1nCtDe9dqfig7g8N4zKuHYTox3VW1yr57PIVzBRUTH79O2WYZqFkGoGHG2SiZReF8iAkCDPf1n9HRZVLxoRIcLpCIjbZhU3gGXovR8nFYO_9FCi3qTzNEfuvKCoCwSEOEBcm6QjZmamPWJDOi_HrchZ7DDOeul_uU_tYv-Nc1Vg5GQuyft2sn_fxBzFOeS5anZlYtNbBfcjzeIdsOqCB-nzB711TzTDXpZNQK433QejMLfbCWhMRq-8HilOQzJWGmYgCzBZ8TygZLiY0AKcHSx0rth3NvCBTIsV2kCXk-N38OQ6J1Ge7jsgAC4bQA8wvSblZduE4emBNFWt7lVaLGPi_p7HAcTBZ21Dy6pIj4uDfFurq5SXCW8J_7JGHSk03Ms_altdX5WW-n-5si4kO9s05laXP8_HEYabGli7xMy-iCrusJpGGbxWiYGFLaIcEh-w08g8w==&vjs=3&p=5&sk=&fvj=1
5,Front End Developer,"I&I Software, Inc.","Houston, TX","Mentor junior level front end developers. As a Front End Web Developer, you will work closely with business liaisons, marketing and IT development teams as well...","http://www.indeed.com/company/I&I-Software,-Inc./jobs/Front-End-Developer-5e644214ce566e18?fccid=b3ac79ff02de8be0&vjs=3"
6,Front-End Developer,Sphere,"Houston, TX",A technology-related achievement that stands out from the average developer. A minimum of 1 year of experience as a developer. We believe in privacy....,http://www.indeed.com/company/Sphere/jobs/Front-End-Developer-1cc82cc42f23136c?fccid=d7759c0728a9bc62&vjs=3
7,Front-End Developer (React),Expero,"Houston, TX","In this position you will take interaction designs and wireframes produced by our world-class user experience designers, and turn them into front-end components...",http://www.indeed.com/rc/clk?jk=0a379f6dd0c07358&fccid=b3849afe7b6c9bf1&vjs=3
8,Web Developer,Boral Agency,"Houston, TX 77056 (Galleria-Uptown area)","We are seeking a Wordpress Ninja, a Developer Guru, a Coder with a heart of gold to work in our Houston, TX office....",http://www.indeed.com/company/Boral-Branders/jobs/Web-Developer-77fc9632e89a2db7?fccid=073c21026f793b9a&vjs=3
9,Front End Developer,THINKLOUD TECHNOLOGIES,"Cypress, TX","Responsibilities: Thinkloud Technologies has job openings for SAP Consultant I. Jobs located in Edison, NJ and various unanticipated locations throughout the...",http://www.indeed.com/rc/clk?jk=c0d3d46fdab9ff2c&fccid=7b0e9e4d97f6ed68&vjs=3
10,Front End Developer,Occidental Petroleum,"Houston, TX",Looking for an experienced front end developer. We are looking for an experienced and motivated individual to fill the position of Front End Developer within...,http://www.indeed.com/rc/clk?jk=da95cb03485ec9ce&fccid=bb9c9acf57da431e&vjs=3
11,Web Developer,iDoo Global,"Houston, TX","Positions are located in Houston, TX and will involve working at client locations depending upon project and/or client requirements. Periodic travel may be...",http://www.indeed.com/rc/clk?jk=b04d8065d5942a86&fccid=f016349d0e53666d&vjs=3
12,Full Stack Developer (PHP/MYSQL/HTML/CSS/Javascript),Comedy Driving Inc.,"Houston, TX 77079 (West Houston area)","1-3 Years Front End Development (HTML, CSS, Javascript). Full Stack Developer (PHP/MYSQL/HTML/CSS/Javascript)*....",http://www.indeed.com/company/Iron-Property-Insurance-Agency/jobs/Full-Stack-Developer-581a33e434ec575e?fccid=7d80c0ca5e8b30d6&vjs=3
13,Web Developer (HTML/CSS/AJAX),Newcore Technology Group,"Houston, TX 77002 (Downtown area)","Experienced front end web development with HTML, JavaScript and CSS. Do you have a background in front end web development with technologies including HTML, CSS...",http://www.indeed.com/rc/clk?jk=2f7288af520e88a4&fccid=25405a63627fcdbe&vjs=3
14,Front-End Web Developer,Lakewood Church,"Houston, TX 77027 (River Oaks area)",3 to 5 years of experience as a web developer. The Front-End Web Developer reports to the Senior Manager of Digital Connections....,http://www.indeed.com/rc/clk?jk=5917a3fe412897b8&fccid=d559120e3090f422&vjs=3
15,Front-End Web Developer/Designer,"Primary Arms, LLC",None,"Front-End Web Developer/Designer (Houston, TX) We are Primary Arms, and we’re looking to hire a Front-End Web Developer/Designer for our exciting e...",http://www.indeed.com/pagead/clk?mo=r&ad=-6NYlbfkN0CPf7BvP3mETVdnHQTHHj7vKHh1HGGimUOVUMjD2QgXH8DRgpEMtM_sm-XF7j4VSjKMnZ0UA1IezXanONxX5l_mBYaIMX8czjeaiV-ewE5WCRiKVMffDEwJmNUZ-6GQW-AHHRm8SEgpc6b_asw2SW9PygZLyN8euZM_dOKJsnIHwi616axBaqvHp0EEn1YOn9MIfQ-CFsV2IcEFZIMegXLdbXnUTJB8bClCuM_IX_qfBo6QtzXBsMZiLUfEb2wRou2spEhWs5NMeXBV3mB_swQkfkSwVnEDENq4GGqVaasXHM9ftZtuitU8iuz1OsYe-1loFIoAgracrOIGes695MAF9SvVCYLRlMMTG1mZGy1CsR6Z7_EsCqvZaVANB3au6EvHjZ5pAiooyRmuOSKqvD3udpIb2ieVh6phB7RQsB1mgO5eqNyzZXzlmoaBMZCB4YArZOzSftNKtQ==&vjs=3&p=6&sk=&fvj=1
16,Front End Developer,Occidental Petroleum,None,Looking for an experienced front end developer. We are looking for an experienced and motivated individual to fill the position of Front End Developer within...,http://www.indeed.com/pagead/clk?mo=r&ad=-6NYlbfkN0CDibRvPqijAsqagEY3iyZWa6_eypXWDnbORbRJ1rhV_FU-By_wImI1d5xB3dQwD0S6qDxT5OD-XvQhWzbXJpHBNJlF59efDgH2XC__7bWqkOjQZrHp7toUapE_qfCCAH-xRM45iybxtlLmk3oxdI0ogVfSGlxVGY8FSmUoC0T0BX5uyGECm91EAHMIKQRRKobwJj7CSF34SBJ0u5260Ke1UTB4i3mPqTLk5FN0EXvTwEHaO1qgv7IZb6SYFpTBEMdIhgdjpjWGvoQW82Ohl2uinFdmKbvGbM1mlMobZcbSvAe1EAyiBwvvUrdYmx2cp0znq74-N7dVUmYXYQ0RklMrcDVFVkgwbeoFsXTm_ElpSWqrLZAmK1AgOWnBY8LA7m8uzSzs476bu6p_8Kc4bzFkWSZ1js8_3uf2L0aNeJ5xOMYbUecZv_8LUL0T8y4RkVDwdlHz-SucRthFDPBx4u64QyXus5ib0eu5kvXZz70NGw==&vjs=3&p=7&sk=&fvj=0
0,Front End Web Developer,Automatit Inc.,None,Front-End Web Developer. Detail oriented developer well versed in best practices. We are currently looking for a Web Developer that has strong skills in CSS...,http://www.indeed.com/pagead/clk?mo=r&ad=-6NYlbfkN0D76A4Yr2NrbB4EDlrJ7bTk4hCbGHycWYeUpi0-lM6hv-9VZcSMggB_QZ2wlZfE1Od4SBNn0jnh7IMXyZPICXklU9dr2BmNEHOf3jDaUaIRN892JYzJcuuOjY_-1S1L2wxib7YzMEhyJJkH5VQpRFvFd8Rba9Gl6j_1c3yfJ0eaPUNpWs8ClQ31n9I_JiPrhJDPQ_Y8g0rLtm77QsWwH_5JBMd0AC5n-nLpqFevI60nIB_67BUt3-nVoN9-Zw8MXwM2no90UpgWl2l7Bz3QP8iZWWtbwLeLgvfwcQVoTefUEdoQ4ODV3DtVGEDja6kj1S1nmVYz82y7WbeUR7hztgH36uPPGsTlLAnkVq3PLw6hlVfWLRDLb0HHlf3V-DhMU4eGwTC5cPNBi4i1xtnOof-n_qnjWRJdza8y1hziJh38Oa1mLZl8Fnu7rL_qqnEYh7M=&vjs=3&p=1&sk=&fvj=1
1,Front-End Developer,Staff Matters,None,Front Web Developer. We are currently looking for a Web Developer that has strong skills in CSS3 / HTML5 / Javascript / Responsive Design and that has the same...,http://www.indeed.com/pagead/clk?mo=r&ad=-6NYlbfkN0AtO1-dsP1CF3j1QeRchzcNKkk5D5K2DtLnBY7EFwSPvDsz-y8ZLKL9Xt2ynZX_FjZUXsDOCEBchQMsGB64DXqDC2bzz4tTmD-XqBhDz5Cw7QxSvLRtZc8sYvqecGYOmgfMzQKiBsK8vY1A0qf0hly1q2sFpuwClETAnv1dT7Iwle0rpqtOGXXHWrtoEoKDkDulaid1JHhspQdOzFdz6CUv4PZVmUo-TwS_wVd5-foyhCZig061MpHeNHKuazS6yx-6Z9O5uKDygTj_I8uKc1jqwolakqkN6txQFSIeDvwBN9u4xxFHmipj-HSY4u2Ct5-Y8AYPDeFppaQad1Evmyh3K3jIapja6-oIVO9Tjgu5ksU4FLL5J0-h_xixvj-4VgfcFnOBcoXB8wNWVYOXFnOmJw72sdBbm9EKE8acPBN0tV_EebPd7IMUKmRAT5EZDenDAhvJq33stvRSsMYT_5Timo0k8-SMkCinBKsx-4GEqDtuXBSMvMPF12Y7Lbe7YehzNe6WsGmFeg==&vjs=3&p=2&sk=&fvj=0
