,Title,Company,Location,Description,URLs
5,Entry Level Software Developer,Mobile Apps,"Chicago, IL",WE SPECALIZE IN THE CREATION OF EXPERT LEVEL DEVELOPERS IN A HIGH DEMAND TECHNOLOGY. We currently have 5-8 slots open for a developer that possess a love of...,http://www.indeed.com/company/Mobile-Apps-Company/jobs/Entry-Level-Software-Developer-a7b84853833fe17c?fccid=5208320fdd2b09a3&vjs=3
6,Job Developer,Chicago CRED,"Chicago, IL 60601 (Loop area)",Job Developer Responsibilities *. The job developer responsibilities include:. Job Developer with Chicago CRED (Creating Real Economic Destiny) Program....,http://www.indeed.com/company/Chicago-CRED/jobs/Developer-e2024ecc7841475e?fccid=61d0e51448cb404b&vjs=3
7,Entry Level Software Developer,ThoughtWorks,"Chicago, IL","Work alongside incredibly talented developers, analysts, and designers. No more than one year professional experience working as a developer....",http://www.indeed.com/rc/clk?jk=abfe0c3a3fd390fe&fccid=3c650abdba68c61a&vjs=3
8,Technical TV Host (Developer/Designer) Chicago,Framework Television,"Chicago, IL",We are seeking technical television hosts to work with our proven system to create technical programs and courses that we will shoot in our studios. We are...,http://www.indeed.com/company/LearnToProgram-Media/jobs/Technical-Tv-Host-ed139de2a9566cc3?fccid=22fabf53ba876bba&vjs=3
9,RPA Developer (Blue Prism),Krish Tech Inc,"Chicago, IL",We are currently having an exciting opportunity for RPA Blue prism developers with having very strong work experience in Blue Prism at least 2 yrs and over all...,http://www.indeed.com/company/Krish-Tech-Inc/jobs/Rpa-Developer-87ce1c628a9af485?fccid=78baea735cce40c0&vjs=3
10,ENTRY LEVEL BUSINESS ANALYST/QUALITY ANALYST,Silicon Systems,"Chicago, IL",Experience with supporting developers with creating test scenarios. Experience working in the scrum or agile development environment supporting a software...,http://www.indeed.com/company/Agile-IT-Tech/jobs/Entry-Level-Business-Analyst-Quality-Analyst-d7e135f7a8b742ff?fccid=3d9ddec35720d15c&vjs=3
11,"Product Developer (Beef, Turkey, Deli)",US Foods,"Chicago, IL","Product Developer (Beef, Turkey, Deli) - 19000145. Basic Purpose-The Product Developer (Beef, Turkey, Deli) will develop innovative and consumer driven new...",http://www.indeed.com/rc/clk?jk=9a55e748225ac317&fccid=ed01b5fdd54d798c&vjs=3
12,Business Process Management (BonitaSoft) Developer,DC BLOX,"Chicago, IL",DC BLOX is currently seeking a seasoned Bonita Developer for a full-time/part-time contract. This is an excellent position for a motivated self starter that...,http://www.indeed.com/company/DC-BLOX/jobs/Business-Process-Management-Developer-3b6b8121d655fb4b?fccid=76f5babf13eeb994&vjs=3
13,Front End Developer,Fierceli Inc.,"Chicago, IL",• Develop new user-facing responsive features • Strong knowledge of Angular 5 and above • Knowledge of Typescript • Strong understanding of RxJS and Stores...,http://www.indeed.com/company/Fierceli-Inc./jobs/Front-End-Developer-d7f4cef95f72196d?fccid=1a9b9197b4a9a4c6&vjs=3
14,CSS Expert,Audentio,"Chicago, IL",This position works closely with the Lead Front end Developer to complete client projects. We are a team of designers and developers that is drawing fast...,http://www.indeed.com/company/Audentio/jobs/CSS-Expert-8f130783695a70ce?fccid=eeeef71ae13a48fe&vjs=3
15,Web Developer - Wordpress,envisionit,None,"Envisionit, an award-winning digital marketing agency based in Chicago, is seeking a Web Developer to join our growing team....",http://www.indeed.com/pagead/clk?mo=r&ad=-6NYlbfkN0BNzKTXDyFjrWAGsC-WgyMmu6QNeO23wkY6iOJjQadgW2zdQgww2m5Zve1ZlVWXxfM_5C72GLq_qOnd7vrzBfspBSCFX7Wbmhb_dsB2WOQK7kwEP_4dVpq16rkJc7YWlIwWrTXkmIVwV4oMJzz7MQlWPJZ8z3-c9rUPYHlbtQ4mvH7SRLP9_jtoFaziV4hZv9A6TAOjzMWhreG9btI76d5UTPtvgvBev5G3Sv6zNAWVx63B7WKbCGd3HAEn9y739uFj3pXKtdVBI8WzqrSzijcs8S9Hzuk9kj3CdlEQZMD8hVzGotfmUFH-IdGDeg-wmA1LuC6GnMCIgMJhMKOSeZIzSn6pjVrPBeSz1n8B6nBg_olhQo_Jvt9yIijJI1U1ji1pt3c9pZzqrTGgk8Si-azhpaXKrxdO0s39C0bymv1GZNWGl89T2p0d&vjs=3&p=6&sk=&fvj=0
16,Technology Developer,SCW Fitness Education,None,We are seeking an experienced hands-on Technology Developer with the ability to work from home for an established national fitness education company conducting...,http://www.indeed.com/pagead/clk?mo=r&ad=-6NYlbfkN0AD1wb-XakKWICjS2D7ifnLrKNWFrrBVdEBSulLM4EBbStIzJrcdLLdCmUCOM9I_8-DmKGXtDcrmZCnJlUNi6soNFgWk-RfskM3m4To7kSn6KYfdllScfMzZvLPXQOwVEB_BIBHTcA0WvGGIa0MInD9LBT05eLqiizJAp-zNPB2ptH0JKV2dGiCWOoqdG-0CG3ZB89i1PkW4zxNi1feTUAijPWu58pecfxddSgVG6eT4NsAlK03zw050zEXKDyPHxDz3yve_Pr_sRmzERIvDZJeNxokICi5FxWLqIEZKo_FpL2w0FiSU5tvsatcB2zEFNXDT57h5qPC5A2SG7VwWZBMCsEl1PNbrdRDp8Af64juiRadIq6eZvzwm3m2EMG7bMn5f37uOWzQ1iOYuqdoUJq28Mq5l9bcz7r_Akg_EJpzZ3K7l1JQ9qYH8JOCZH7wyYA=&vjs=3&p=7&sk=&fvj=1
0,Software Engineer - Electronic Warfare - SYR,In-Depth Engineering Corporation,None,In-Depth Engineering is seeking a Software Engineer with 2+ years of experience to work in our Electronic Warfare line of business. Specific tasking includes...,http://www.indeed.com/pagead/clk?mo=r&ad=-6NYlbfkN0AyiU7I6MWEx30T3H0_HRYer5MNRXwPMwKbuYIwS-YHD96OZCtJQ5_0seC6C6HljI8yFYZiF6PKmhvPB02-dXKECJ6ng7y1R3z9wWkT0O3-mUeB0yxG-8fOhUJPp4jcNMiGhmVqG20AiAv10ozHFVTX8IwmJe6i16dQ0Zb7ofj7aNGJMDh_spHNmgqq0_BQ9urzWbJeXGmgxfeALtHQxoDDKQiPwlEzhQmda2D-hasOOmVqMOFV1jPGZYXbEY5v1VuTmieHXDL8EO8NiIXUJm8C_0c6jMh-KfPOASAnyoPY3mla1na3LyhiGC9fh-Xkf4DT4qE05_Q2ojSCX9G-qIl4zsKTo26BhP158XeAah7tfeXNMBMgyEIUJnvIZMllliZwTua5XDC3C3U3Q2zcXEL1ivWCdkIBSvdTryid0W0MyHMaFWQ20Yt-cQkhhdLgDx9hW5IWfDacsjN3L_wyR71eF3u4mOvz1kr4Ngbo4NSP44q7tFZKxAQa5Teb7CEFpERJcatyxo_2Kg==&vjs=3&p=1&sk=&fvj=0
1,Web Designer/Developer,Hudson River Foods,None,Hudson River Foods is a pioneer and leader in the Natural Products industry. We create and make healthier foods for healthier lifestyles. We are looking for...,http://www.indeed.com/pagead/clk?mo=r&ad=-6NYlbfkN0CLHE08yXwdS3kphT9ia5Dfi159ncC5jFJ2yZfE4eNTGzGH75Q8w40J1JmRiO6B8Qcamw4qgVzOiqNzCjBsShYPj4gdADUfrPLsijOKyYni0bvV_KcV4fduCrPsNP25x_zlaoY1hvlwXkDhPef2rJj4jbs4VicGbpKP7SJrerVdClpmetgaKffJeZgFi_QJNho6Xi3r5kuuowgSdQmIbzCOFwMLY_Sheqr1d_AvX7jIgHDFf06BUnkENJlsSRFwNmqqMo8PwWbLDgIHpMrgH4yEA0SRsJK-inRNCDylqG2qWJCm0dJEMgj-BZUw8NUAXsVWi1EUAFmGhhTqAxmJR6Oi0Fkgpw8-HCwAg5Z-_qNGjtSEP4gpg09QFqVs_-kMPlDV3RUoc02SiJ4iOZuGj9PE28wIiRQmkunixrqVjfIryQ==&vjs=3&p=2&sk=&fvj=1
2,Software Application Engineer (AI-Driven Web Application Tes...,Appvance,None,Likely you have been a strong web application developer that also loves to interface with people. All applications need to be tested...and Appvance is leading...,http://www.indeed.com/pagead/clk?mo=r&ad=-6NYlbfkN0DGwhwYHwL-e6KdDqyQrsrdTvahay-oTjI12dZKcMlGfjO_h0PacNSge_DcgH_TO-LBYIs78A1QCEP9ChO-DEWF7DQRYgu0FfP_ZQvmMXmvVfHudwaEJNKrew-aQbpOHwuGU7Pxc5U2F5rH85mm9c9nFmvUAFFGy77J86Mm821oz9upN4zoGgxXOvph_0_jlqscV3H2z_6mnVTFB1m1naIrnaL2-n5_El_qBMDvfdPrM7Y9J-bAxWD_rzwuomNq1aoj22-2QG5rJALpvRWU20pM1AYJlwlFoIaClzF1BWFceF7DmeBCvDjd15_ldTfSjGwKDiCIv_69Ej_IatlQLXXa9GMw_Y_20Utt0WWLAjpSrb109TiQ8PdjwcmrVVk7RrZ5z36miHwIt9WOLhR2fRhUh7IyDBQt_LB-CkFElpmobiiMnN5zzERhXrAlj_Qz2tc2t8_QN7UwTONU3kllIJ2X9X2Q7T6TyguZYr6TEsBQOw==&vjs=3&p=3&sk=&fvj=1
3,Full Stack .NET Developer,Fora Financial LLC,None,"A Day in the Life of a Full Stack .Net Developer:. Fora Financial, located in NYC, is a leading financial services company providing working capital to small...",http://www.indeed.com/pagead/clk?mo=r&ad=-6NYlbfkN0AVmeVdBxbwCBum3pEXmqWPa4HbGlv0gYd5ueWyFHBBN-oqe7oKACOrvuwsWm9Ums35xzbl5-IKwDRn7deTbjaPXJygsZPVK7w1m_fqFtUO4VGz_xvpSSrzN3l0H5GlPDnCYjY-1vWwGiO-WTdZBCyG4MnTaxEoF85WyWIxx7P5vuzbwggaaVCxPmCOOpCtVZPLxqRtveyyKmtMwRSt3Ge5sTzvcuivaewVz3Mo2cKPs9c2vUtBTP5jXTMsAYpZnM1mPjg4-zv09fy37dLJsF-8XpjbDDEyV225abI6WmV8uqgS5QnRja_qD7fKgO22It9jiif1_-ZugNhCdVQcb22iD98HO5IjNDUrEghGMq4RF67fh_LLRapwU4RAijlssNh1wowSuqrZy3M6klTXNtDiJDwhO58lrWL3ngkq417Jm3UKK12IuJ4BSCZ8wkrRXKzLCRZe1wZeE95klTuBi5vBZrb1cgXpmwg=&vjs=3&p=4&sk=&fvj=0
4,Web Developer - 262383,Procom,None,"Web Designer/Developer On behalf of our enterprise financial services company, Procom is seeking a Web Designer/Developer to work out of Getzville NY. Web...",http://www.indeed.com/pagead/clk?mo=r&ad=-6NYlbfkN0BreR47D9bMWJ28XlwS8rs2_GIFY3-vSdy_Xwl-swcV-mu1ZFQXgVSpWtMe3rAMydQcre64HxwZqeHvwZl2eKdZivYVmmeIso24jr55Y9yn__Pq7-8aAsRCJ8eL8Hug9yqea4rna3icekjGhOumrkkDqJSC2_qfhko4YLibiAd9TOAvBUonSr3M-FdkIAGC5VSrwuip2a7wX-CyWnPbN-k1zAyzb-8XiXYyiNVTVsI2eBFexzGJlhY_-WLDS0M7XoxTvqdeWmIpEDvFFmBnYxqaG1a3wxHhSwl9X1wD20ooPWk-gDNA5WvlLgESsWYjDAvHxs3y1x3uU5lKBOJr4tTOW_l4vpv9o-HrQwRUs-ngGBurGGdy0YgBo1bOqKe5gwz9n6qNOGxA3MjWESGBdXXvTV1_Ci_9Cvf3cQRVOgJUKL4pSuRXt__1ChKAzbJRulm_EX4f9qFTVcg7ND-Ug1u6LzBJHmv9iM8kexzTciuuRC48BeLGbroYhm4DNu65acBQmunhMNsO9EOuzgVUwiV9vQE5HMyZmMFoWJNT4VP_77NZd-RtSGZM7UKdyhWLPkRLcvJcWRQkT_tT6ZDfR-s0&vjs=3&p=5&sk=&fvj=0
5,Software Developer,"Coast Professional, Inc.",None,Developer ensures that development life cycle activities are consistent with generally accepted best practices....,http://www.indeed.com/pagead/clk?mo=r&ad=-6NYlbfkN0AxG5I7D4vR6XANN08NEeIOzu1GXNLxDB8N5v-k2WCiskcr_YZ1v5ba7qyZgDeEitoqPd3b8FFktxLs4-22hiveSMgNvjj_z5hylgWDMFMKNPs3CFYfXA8npYtf2WgYHfrUyyQonHyZj1rhuE6xX9HqNgBk3a_wYJuhZ0n7uyHtSCTRMRek_tZEhedRgX4MvKmpSBt6fwrlwtliX_Qfol2t3KU_qZ67-KxapRl3_OwuqFCpE_bBhAlkB8MkWeGi02l4CXgj3pMJCLrrWr7z75woudLvlu4CPedY0qkdBNsEK2wm_7ezCYRU65pbZ_RZOcum0HHM-Q362-AHUXFhEqk2-FY4ylc8eKjPpZFPaWvdB2HPFm_u8IvsG98wUuvkaYk9XxGtwzI3lth5l1uCnQbhYD9mu4KMP42HDZgF8ET-WfrhakTL6wV9hSzpDyDtQBAzsvpnPaV0aeCVBY877Qz62vOzNYsGR2gOr5vpytcegbSC7QjyTyIVC4M41PjD6a0U7J6bAdS64Gy14UVQ_Q0eWCgwFCe2MiCBML59nG4A4NWS-Tgz27eAfeCp6pBvLkM=&vjs=3&p=6&sk=&fvj=0
6,Architectural specification Representative,Quartz Master,None,"The Architectural Sales Representative is responsible for increasing sales and product awareness in the designated sales territory by calling on Architects,...",http://www.indeed.com/pagead/clk?mo=r&ad=-6NYlbfkN0AQ_sfPWKo4LTn9shgaZQwTRjNA9cFlU4OwmYDMMGiAfScToPem5CPps-_iK6YvtGhBdSy-_jbE5h4vNX3tq7e80iWZGXRQnicVPqyh3KlbRdsWxya0MwiO6WtNcsc27_x1_-WFMMju05k1COAOyCsL-2QvfDZocHVhOZsBLm2qb4pX3YsFZdGd7xEJXBiylL1e_BLTpZPNihF_nmzRozj7lfyOkUXsyICO9DgV__UHxysjHHGh4R1xADlj77bNITRb1Y-KXE9x0DFsWd1L4sstLPxQV2hqPoHGKKo2zv9Wly9Bn7XfpQqpc22fOkLsRIGyWQibJK4WmqZjSsvt5OP4LREl15EfYi3lL64RLYBwqDs5iLA7jPjOzgCeMueQU0rzrhpXYNSLTBDpQozZuD630EFmm9LZuk6hmeUVKuuyizhi-OeuHkQ-nAub1VL-s8bk-3mQkMGTrQ==&vjs=3&p=7&sk=&fvj=1
7,Junior Developer,Gramercy Tech,"New York, NY","Our Manhattan based development shop is looking for a junior developer to join our team. At Gramercy, we are passionate when it comes to learning about cutting...",http://www.indeed.com/company/NY-App-Development-Company/jobs/Junior-Developer-3477547fa28b0fe0?fccid=2547b364f9b8ef35&vjs=3
8,Office and Apartment Cleaner,Adam America Real Estate,"New York, NY",We are a real estate developer looking for a bi-weekly office cleaner for our office in Manhattan. We also need this person to be our cleaner for our...,http://www.indeed.com/company/Adam-America-Real-Estate/jobs/Office-Apartment-Cleaner-4d7a090161b35a9e?fccid=ecd300be8a90cde8&vjs=3
9,Entry-Level Production Operator,Corning,"Oneonta, NY 13820","As a leading developer, manufacturer, and global supplier of scientific laboratory products for 100 years, Corning’s Life Sciences segment collaborates with...",http://www.indeed.com/rc/clk?jk=4fdd70d7e87e188d&fccid=31bebfb78bc1f0f1&vjs=3
10,Ipad Developer,Konnex,"New York, NY","We’re looking for Android Mobile App Developers The pay range we’re offering is $65000-130,000. We are a growing Technology company based in Washington D.C that...",http://www.indeed.com/company/Konnex/jobs/Ipad-Developer-3ff9a145afb8980c?fccid=34fc79ecf614b7c0&vjs=3
11,Entry level Developer,Gokronos Inc,"New York, NY","We are looking to hire more than 100 software developers. MUST have a Bachelor's Degree (preference given to Computer Science, Engineering and STEM majors )....",http://www.indeed.com/company/Gokronos-Inc/jobs/Entry-Level-Developer-4f456e276ccb51da?fccid=1e27cc7b6d98100a&vjs=3
12,Curriculum Developer,Research Foundation of The City University of New...,"New York, NY","We are seeking a smart, enthusiastic, flexible, and focused person to work as a Curriculum Developer. The Brookdale Center on Aging at Hunter College strives to...",http://www.indeed.com/rc/clk?jk=26a584f624221263&fccid=667ba717ce627077&vjs=3
13,ENTRY LEVEL BUSINESS ANALYST/QUALITY ANALYST,Silicon Systems,"Brooklyn, NY",Experience with supporting developers with creating test scenarios. Experience working in a scrum or agile development environment supporting a software product...,http://www.indeed.com/company/Agile-IT-Tech/jobs/Entry-Level-Business-Analyst-Quality-Analyst-483ee13f00e3e517?fccid=3d9ddec35720d15c&vjs=3
14,HTML Email Developer,Mastech Digital,"New York, NY",Job Summary 3+ years of professional experience hand-coding HTML emails Ability to work equally well with legacy table-based HTML emails and modern...,http://www.indeed.com/company/Mastech-Digital/jobs/HTML-Email-Developer-7ea1a14b98d31959?fccid=44432605a1a5bfa1&vjs=3
15,Content Developer,Regional Office of Sustainable Tourism,"Lake Placid, NY","ROOST Content Developers also maintain, write, and edit the content on our nine destination websites. The Regional Office of Sustainable Tourism, based in Lake...",http://www.indeed.com/company/Regional-Office-of-Sustainable-Tourism/jobs/Content-Developer-ca09e61e4f0fda4c?fccid=dc3082009838040a&vjs=3
16,MEC Developer NC011419A/NN,"Hyatt Leader, Ltd","New York, NY",JOB DESCRIPTION: This is a terrific opportunity for an Infor M3 Subject Matter Expert to take on a Leadership role within an organization that has selected...,http://www.indeed.com/rc/clk?jk=0e41ae7f20a58537&fccid=52ef0090ad988cf5&vjs=3
17,Senior Frontend and Backend Engineers,Giledan Search,None,"If you are a senior frontend, senior backend or web developer, apply today! Our firm has been retained to find several engineering roles....",http://www.indeed.com/pagead/clk?mo=r&ad=-6NYlbfkN0CkCIu0M5CPAcDxHID0I-TO9EtEAs0RjRILgEllPsyDlv0nlAN_a3GXdD5ajVxLWXrUXxgNhYWgcZB8hivWOwSIvu1dXoUK8niUwrC4On-ZZVBQanXXOV7SMLvMdlcR98UhFCvFHUd4WxECOwBU4tSE0msVn6ZHDPxvt31pHRy9pCq3kL46mCJOdCshR5adiILTmE6JD-voAzkzK-oAX-CDU4iyUWhT0-JuAeHkxOOdDOkdu3O7Rq1VRLaZaD0QQfwVmR5FTCapuJTbGkPYypd6YjFbVYIDGrGpo9DhrdXQhu-9b5EAKDQ_fVITDs8Cw58VYh0Si_EEbZqsSjYTUMMtQMmHhmdLjVIC5ZunDUrDUfYbeZGPkAyemnkuvqX-npzaWattjs2rXSCfKpCgJSY19fgHPJyd2dHEyHuAUKbfjtG3DTeHkXbS3ItwyGG4UXy30JScECFfrTGQyFMlPCgj&vjs=3&p=8&sk=&fvj=1
0,WordPress Developer,"LDD Consulting, Inc.",None,LDD is looking for a WordPress Developer. The best candidate will bring strong web-based application development skills to help us grow our website development...,http://www.indeed.com/pagead/clk?mo=r&ad=-6NYlbfkN0CWgF9x7hlTDFnTfVN7Do3Qln9gQWOMw5XLYswlvh6DHy6lqs6PHXTrIiUQDaXhEpcbMmc3hOxqjaUlv3AufXqvzK0CN7-XeVK6fREt06GXOMKKGaapZy4EYf_JGBC-jpP6acO0QaW_6EcsPakbvRwdd8qy2sR1ib_WohhUXym8dZ2ybuSSOted4sTu7GzmD9JITQATRCVNQOKLEuM3KudBDa7XM-uGAOw1HViyFv1-zg7vjbIId-0Mu4eaEMVetZxcpfaftZ2eqruyqCfzHj4CeEIomkfgWEzIjNyHGmYC8mDgCL5H5OcSrtDYgGcBmpAdOv-pa49nJ6yv8SraKTWkmwgliFE9RLMh0u1scd51ONHH18u3crPJvOdybrlbrm0fFxhF84lV8Nopdyi9pANOs__Id3rtgOuXhK81nYOewkrDBooVGjOr&vjs=3&p=1&sk=&fvj=1
1,Instructional Designers/WalkMe Developer Needed,"Chic Geex, Inc.",None,Client has a fun and sharp team of managers and developers who are interested in gamification and cutting edge tech to make training more engaging....,http://www.indeed.com/pagead/clk?mo=r&ad=-6NYlbfkN0DlyBVYWGvruc35P05ZtenaiUsSg3rvudzBlvXEuPleCwIziWfVaWzQSRjuWll92nmFT9s5X9SjH5WL0uc79j5_oC83OpyMpcSJPaVjRjcrjTaLJmJfBTcOEXMV9E4vUlzJF5gZEpuVgy5QUp1z54BDavigr0srMlz0grdb9SuENsgn8TBSIeQ8ksqFdvpPPWL7jjB00Zp3SBqrtO6OP_39pvbgRt204FiOMjyJFXjYu6DuY_ROG778qEfZFdu5Uawoeua6k7tM_8bp03yqz0vziI7cVXKxnZo9mOu5ASXhtTRzHm7rLBTmIp_DOLdhlS_tZZfO0xa7547scdoLhPmI0rVCdmGYXH4cxumNNT7XR8d87quowRc1NlcduRvk4JtOt6GI6X0eGCuIVPu5J1pmCbF82WRrmHdP_4iC95IVaAmz4VosYnAnKL0eZABtnDSvARsrAof4VHf0GBRS9_cB&vjs=3&p=2&sk=&fvj=1
2,Job Developer,Mandy's Farm,None,Mandy's Farm is looking to hire a full time job developer immediately. Job developers even assist businesses in creating new jobs for people with disabilities....,http://www.indeed.com/pagead/clk?mo=r&ad=-6NYlbfkN0DyFC28ppERc05ku-6vp6PNeuCYpaxDcezMpbbEQeE9LX_09_WfesOzQdfTpHLL2Y5iyjXGz4yj9b3GeY4Eg8xbmb2KwmpWLTSDr7cLJnwP_RiRaZZFsnxYRQSeeqRGbnF-xv-Sqx3dDW5VeJJUw6fR23wowualHqF_aG0LbAESOI4n_mkHrzmgXA3hOvlNkeiMEuxsUabOgktDZ8H3tH7VUi4S_HosU_pa2XwkP1q1ZrLXdna4hsTChfKtCq3gHVyKItlXZ1zqzv1YO3uQ1W3IDS9kVnqg9LyU92hztJDphHQm2w3nDiAHgyspKihCy5dlADYySGoA040zNH6OP6utS1s1G7WKtaPvC1TNHZ3XeZenyj2_qZGhcRV2-6lVmx4OyWaE0viOqpP3dKwfkK_1_nELLqSlVpyUv5W65fL4Gw==&vjs=3&p=3&sk=&fvj=1
3,R&D Computer Science,"Akima Infrastructure Services, LLC",None,Seeking a software developer to join a team working collaboratively on a project modernizing physical security systems....,http://www.indeed.com/pagead/clk?mo=r&ad=-6NYlbfkN0C0UwnAyWXzgsZcazx71xOr9SCmv2WdJTnAcwuhGvSMbkZAFld0CuKX9GD1ORzGafVaC0msdLQ6QuHgo_ytxIsNdfNONXxKOCdO0Q8JrsOsjIdITQb_z6yfn79r9rn5v-bsN0ADlDE7Gfd22DFk2HWzd_ewtS3HYgw6pEZaxkDq8gwvsSGNLAZJEuY26RMPhhml4nj69ePu42TqLsIUjJQJuyyI37tXWGvmSym9vnjF-7CwK_xwLSD4Al0YU4j6Yy0egnE6zBrBAzBYy1o67Dhn7UwuVjK24j_sgWTK1MA3lKsVSwR44wyv_848wROEvyXMKBMrCXO68nBTl_fKlm2dfNYuhGTit357XLf729uy1Z43GEriTNLriZO4c8ogc8x__mi2chLGF7DepClngj7OX1TThvCxkgxBnlt58NuKkXKrIFqxSwGxu-MqiG4k0dk=&vjs=3&p=4&sk=&fvj=0
4,Software Developer-5+ Years Experience Required,Tau Technologies LLC,None,We’re looking for software developers who are:. Have some familiarity with Agile development principles and processes....,http://www.indeed.com/pagead/clk?mo=r&ad=-6NYlbfkN0DqwT61vBnXRQSD7hPZExoxPyq2HPyqtYG4vWO3iOZoetrwl16Myva6x77xsKnSixlvWMDgY07GXjsXFxF0dlWePYNtCwaJzjF8OytEm-Ar1dMijXMA5h0BkQ4nwhKwHIevEqL5blnEUeMDyd0FlFOXiDnxjMCWsO_-ym6yN68VdpATTOFo27DhHWmFqL18QSmTdsozgk5eYyuKrRDVsN0QNdA43m2DOyU-PprZbKOrwPGr3qrc6xzZaWIDTu-sF4H4pUQ3dVCyWkhKRWHUlcaP10zUYza_6aZMr0N8Pc8wppemJb_mQbVJSNFFNuRVdsuCgWr8l5mpdvdbKsaE7ydyiC2HDcDjtEhwHdnP_niLNUmzFX_MM4GMxM9_zZnbbfYgudN7qpBPOftSBAZBuQwJfdT-vqXGDGdbK6KgkKlUVxcOX_ky0jbgoD8xfRHYKpredHOjYD1ZjoX0lV8W41wnU7Ztf6_9g8o=&vjs=3&p=5&sk=&fvj=1
5,Programmer Analyst 1,University of New Mexico,"Albuquerque, NM","Developers, and technical staff. Supporting and managing a wide variety of applications, including working with end-users, developers, and technical staff to...",http://www.indeed.com/rc/clk?jk=05ab31c5b23f60ef&fccid=2f87a7abe4cc3c5b&vjs=3
6,Software Engineer,Honeywell,"Albuquerque, NM 87113 (Alameda N Valley area)","Join a team recognized for leadership, innovation and diversity Be part of a team that designs, develops and integrates highly complex software functions...",http://www.indeed.com/rc/clk?jk=416f0710c97a9ada&fccid=50208b5bf45ee3b8&vjs=3
7,Job Developer,Goodwill Industries of New Mexico,"Albuquerque, NM 87109 (Academy Acres North area)",Job Description: Job Developer Position Summary: Assists and guides people with barriers in their search for employment in the community; develops...,http://www.indeed.com/rc/clk?jk=bebc523452b2a020&fccid=447a13fcd1542764&vjs=3
8,Website Developer - PRN,Lovelace Respiratory Research Institute,"Albuquerque, NM 87108 (South San Pedro area)",Website Developer - PRN. A PRN or as needed Web Developer position is currently available inDr. Job # 2019.019.M....,http://www.indeed.com/rc/clk?jk=0dce2bd1d327e7e7&fccid=13d3e9d076e3c1a3&vjs=3
9,JAVA DEVELOPER,Ace Technologies,"Albuquerque, NM",Java Developer - Entry level ! Need a fresher consutlant || state client || references required for background check !!...,http://www.indeed.com/rc/clk?jk=cf8fd71f0bbfbee5&fccid=b7287cc45de81a80&vjs=3
10,Web Developer,Rural Sourcing Inc.,"Albuquerque, NM","Web Developer – Rural Sourcing. A Day in the Life of a Rural Sourcing Web Developer:. As a Developer, you will be responsible for building and maintaining...",http://www.indeed.com/rc/clk?jk=6eee95641fdec6e3&fccid=9b319cef75410f63&vjs=3
11,Web Developer,Summit Electric Supply,"Albuquerque, NM 87107","You'll be joining an existing team of developers, content authors and designer. We prefer you have 3+ years of full stack development experience but we're more...",http://www.indeed.com/rc/clk?jk=9aae6bb0be587346&fccid=1c53b22d6e63f1e5&vjs=3
12,Frontend Software Developer,i9 Technologies,"Albuquerque, NM","The Software Developer is responsible for the design, development and release of our organization's Java web-based applications....",http://www.indeed.com/rc/clk?jk=77c60334b5154df4&fccid=11c5541c2c6f7d9a&vjs=3
13,SQL Developer,DaVita Medical Group,"Albuquerque, NM 87106 (University Hts area)",Preferred – Microsoft Developer Certification. Where Good Health Makes Great Careers....,http://www.indeed.com/rc/clk?jk=4c921e5fd2b31ff1&fccid=1a24bb600f1a5aa1&vjs=3
14,Developer I,Maverick Technologies,"Albuquerque, NM 87113 (Alameda N Valley area)",Objective: Mid-level technical position in the Enterprise Integration Group responsible for development of software applications while working in the project...,http://www.indeed.com/rc/clk?jk=5af594c9857ff7b4&fccid=2c28ee5fce71c2b7&vjs=3
15,Software Test Engineer - DMOC Kirtland AFB,"PLEXSYS Interface Products, Inc.",None,"PLEXSYS Interface Products, Inc. is seeking to hire a Software Test Engineer for a position at the Distributed Mission Operations Center (DMOC) at Kirtland...",http://www.indeed.com/pagead/clk?mo=r&ad=-6NYlbfkN0DXpObXs4xHAgR-yWXhTXEGAfbAWXKBvXBtGTtLm4BnunhTBSVdxzHcG9PeULGD0uhHuPbgqTHXYDlT-OdrKR3_bAldTR0lsZ76qPKyeTZ9Byuv-29-YmOQEUe3WG8AXGMsEP68xnITx3ITF7bAg5ovNINJg9mv6i5WAInxdYMvcobG8vcLU4_4hEvWPSBi_GlhvmdphK9wjAUze4HhXHuvs51eg2xUpOK2vr9naZXbf6Xx_TIZzcljEVhIqyynDR-PW074rMvVrwha8JRkHD6GqBgt_yz5sOM7dxUNMcZwnYoHBqxAVXt5e_PkoAKROdCZ_-Q_udVYdolf1NotKQ7J-FhGz1lAPFLQuh5sTpQ6Cu4ry1ar2opqUO6Lrkw04de5-QddAxxoAdbZ-vnf6eAk0KEdsH-Dc_OB5o9JlD7gamlzh4PGNGE-2Zu3CQl_Msxhb895zlBahXDeSPofA16O&vjs=3&p=6&sk=&fvj=1
16,Junior-Mid Level Software Developer,Tau Technologies LLC,None,We’re looking for software developers who are:. Have some familiarity with Agile development principles and processes....,http://www.indeed.com/pagead/clk?mo=r&ad=-6NYlbfkN0DqwT61vBnXRQSD7hPZExoxPyq2HPyqtYG4vWO3iOZoenXVhVJ-5F2LQ2JA6iwjDjavLwSuuUvwO9Ix7SAz3miXV7HNnWlelFhGSF5JKRRP-HgBe8lgEVfKZvfBlbjrgP2KJXvEUFiOef7xlrZiwUrzqlC4dv-Lm_DF_pqceQsPgdzyo1nABmYCAYuMyxTPvpJOrtHKWbhDwSjcnQt3Psj66S0LxoPGDXbT0w61Pxhu4mdeVIjTGNZNwOGu8JZ-QFBWWrQaTpc8TI39Oj1jqTWJ0Q37XwBnhdphfuNBN4YuDI_gIAZr3hQ_zZ0cvntMtwxzy6obioralr6LT0j6SaAkqno_B-KT38I95cexIVYOGV7P4wPpPalLohAGp7r0lJOcZ9sOP4eJ5xbpYA71yF_Rzd9CP15iHbWFebIKKvLoFELkmMRI2_zi1dF6bisPz3TtzLH5agdtTA==&vjs=3&p=7&sk=&fvj=1
0,Game Engineer - SkyRocket Studios,Big Fish Games,None,"In this position you will have a large impact on our technical capabilities, working with a small but growing team of enthusiastic and motivated developers....",http://www.indeed.com/pagead/clk?mo=r&ad=-6NYlbfkN0Baal0bOrkb_5xg5EhVVljMnluLJ7oAvqv0XmFdju8Hj80_aDj0FASha6zo2jJPiwsfqq1taoYrAR2Q5AMozjKOsezrXj-Pptjnw6DPgjIPN6TYpMVuuFS8qmRuyxMpbmQzdhUwscUYGTxEfq2rTlGc4AKjTB9YJMvLA6HFpg7r2fQrIfikIVGJrUxbZgBjYtpkV0xvLYWZCL5UEpgLgFqNjz6mDprjV3lE5sP2Y12fB2b_OfgfTVkAEc3iUiF53bxo5pEQIdHkQN1O_TLh9JXBvNqVP4qMsGW9tgUrEoVWYWEhSVjBMeg-VnPdgTZC--mJWNI2SJEmhF-iftKTykcrANkfoLnxAkpHSYNEZCrtwgPpWOqjjZlB7dR1wN7eYcV44t2OSQz4h_oONIwpARquegLWCb2si8ZS6dFMhbc1-vCSjm_9JpeZxDAlYbfC1DAbYmrOTOk6Jw2I35YiB0PFAdK7FcsgDiUSx7288toJ0vT1LZZPNIqMEVUkBITRx-V31TMdKuXWpUyP5PF6Ou-ErDa3Nn6pj_E=&vjs=3&p=1&sk=&fvj=0
1,Entry Level Software Engineer,Opanga Networks,None,Opanga Networks is seeking a talented software engineer with the right aptitude and attitude to join our team. Opanga is a growing company on the cutting edge...,http://www.indeed.com/pagead/clk?mo=r&ad=-6NYlbfkN0A_NMCRWe3Oq_S97jS10DTcZeFeTKw9wokoXGvR9yhuE8KCNeJ8aBAliWQIMUZqEDoQOj5pD0LKKqctLw8Xd8BBALJXTSwowUP4UcZTaXbBn09DP2g9ct5bweFkCxZa6GdP2CQS2YIbpjpCrxDC9LRbibFHGftomkOmhmm8m1MoQBr5hs1uG_OicvSWJO0ypj1G4w3vux7vfL1tRJn4rz9TVR3vBJLRfr1WF8eiL3Sbj2HhH6MtEjwQlly3-RgLE7UEqnZaMzOHYa_-lNQYe21himXXyTTbTkra0GKUuikZ2_JdUBmUySVea4-7n_P22zhK9yOpooDKVa7m9CHKPCed0rqWVqj6_XEJwc35Zx7SwodqwPAUzhse3qU3gcog21NLd3qsLrzN7G4mR_BFU7fmnSCaXurrL4kEsgoreOQ2BqsEEKrPMuQBjZ4vu2FazW0=&vjs=3&p=2&sk=&fvj=1
2,Full Stack Java Developer,Lean-IT Solutions,None,"Full Stack Java Developer-. Experience leading high impact projects and mentoring junior developers. Developer who has experience in designing/architecting,...",http://www.indeed.com/pagead/clk?mo=r&ad=-6NYlbfkN0DAZ3n028Yxhh4crnQjFnenW0BnXm3ISW1EPbuiEaiaZz2zYXq8yJcEJ4oG_0a4epw-3_RGV6zDopxaa13P2hILTtmI8yAL2ScJYnfNhmQGyoHTlNdfODMcJu1PgSr_tByvXJEYQZBAZpO9xLQnSzSZCUGzi9m-UoK3V9HwbXZPFixSksAqfA6VxS61lzzGvkBkbPHnfO5ONASbHOshOyDFzF5NZDxjC54BYIf4mXH3-P6khoK4UQIbmmRflKqDmFLIuQsyco8sE7zHlYngKeKSmZKFI3xRbV26FqgKthLx7bexEANV7mzgGG_edPeMhP8AIPcZJlJQTAyxJ9B1oQ5AUE-1V-ZUTF9VrGLqISpTGmscRgtNalCTDD_eex9K2IK4lL0Fwa98OuULEhfo7NV856BkSliiVRed3q6IiyysY_APRrGR0RRiwaDoNPDSKFc=&vjs=3&p=3&sk=&fvj=1
3,Entry Level Software Engineer,HCL America,None,"Job Summary HCL America is looking for talented Entry Level Software Engineerto join our team in Redmond, Washington. For this particular role, we are...",http://www.indeed.com/pagead/clk?mo=r&ad=-6NYlbfkN0DGx2ICDvFmw1Loc3XdGuHs8Xyifg-lZuXgcU_5tSD_VG7gy1xLxBlOHuSgKH71TGd_geWJPBAMo_bjxodZcdah1t3KnjSHOMgJHLEHDdZzS5yMs6B3OnnlB9-FDt-ob450zCNciBtsCv3r0mZ3BSDU3BaJKHVbXJyMBR7ZjLbvg5hT9NAIkLhwzwP6x0xWkinDBNhPuWdwne20kuLenRzzPXcyrJixIhYWZvACgVbk3dD1k2nm3Dg5x6HG5WOaZdBd8CCjODUqtnmp0Y_7slgSF_LUIM4Xov9QhYBsslgESvNiFRirmGVwkSF7tZ5KhmTI2a06Y1a0NbZ6vUwhZwzQrC4XfWLEReQICfchhy5hubwrOfka7T72s7z3ooxNktohB1QUW4orJZeX-0wd5m5z2Xm1AAf6AynZmJ06gJxMN3I5gI5ANCqU&vjs=3&p=4&sk=&fvj=1
